id,title,company,location,region,is_remote,description,min_amount,max_amount,date_posted,job_url,site,scraped_date,Python,SQL,Power BI,Excel,Tableau,R,Azure,AWS,Spark,Machine Learning,pandas,NumPy,Looker,dbt,Snowflake,parsed_salary,salary,salary_band,seniority
173,Data Analyst,Tetra Tech,"London, UK",London,0,"*]:pointer-events-auto scroll-mt-[calc(var(header-height)min(200px,max(70px,20svh)))]"" dir=""auto"" data-turn-id=""request-WEB:832c394c-b197-4de9-b715-4b5b4d7e04c7-1"" data-testid=""conversation-turn-4"" data-scroll-anchor=""true"" data-turn=""assistant""> Turn Data into Decisions - Shape the Future of Intelligent Asset Management We're looking for a technically minded Data Analyst who thrives on transforming complex datasets into clear, actionable insights. If you enjoy solving problems, improving syste…",47573.81,47573.81,2026-03-31T10:56:43Z,https://www.adzuna.co.uk/jobs/land/ad/5684029153?se=YOufHcQw8RGrBZNbY5I0fA&utm_medium=api&utm_source=5731d18b&v=FAB973CCD413AB8F8D8708D57F5D4E80BEC92986,adzuna,2026-04-05,False,False,False,False,False,True,False,False,False,False,False,False,False,False,False,,47573.81,£35k–£50k,Mid-level
174,Data Analyst,Vehicle Data Global Ltd,"Chesterfield, Derbyshire",Other UK,0,"Data Analyst | Chesterfield | Starting at £26,000 Are you passionate about data and fascinated by cars and road vehicles? Ready to take the next step in your analytics career? We’re looking for a detail-driven Data Analyst to join our growing team at Vehicle Data Global Ltd in Chesterfield! Why Join Us? At Vehicle Data Global , we power the UK’s vehicle data industry. From cutting-edge VRM Lookup services to full vehicle history checks through our VDI Check platform, we deliver fast, reliable, …",25000.0,26000.0,2026-03-17T19:59:20Z,https://www.adzuna.co.uk/jobs/land/ad/5669783048?se=YOufHcQw8RGrBZNbY5I0fA&utm_medium=api&utm_source=5731d18b&v=9670F05AA1865DAACA359CC5E5E17F9C00B08F4B,adzuna,2026-04-05,False,False,False,False,False,True,False,False,False,False,False,False,False,False,False,26000.0,25000.0,£25k–£35k,Mid-level
175,Data Analyst,Jackson Hogg,"Darlington, County Durham",Other UK,0,"emp Data Analyst – Healthcare Competitor Analysis Fully Remote | Immediate Start | 8 weeks Must have Healthcare sector experience  We need a hands-on data analyst to deliver a focused healthcare competitor analysis project. This is a short-term, fully remote role for someone who can quickly research, analyse and turn findings into clear insight and recommendations. What you’ll do Research healthcare competitors: offerings, pricing, USPs, locations, staffing and market presence Mine external sou…",33708.48,33708.48,2026-03-24T15:45:13Z,https://www.adzuna.co.uk/jobs/land/ad/5676938496?se=YOufHcQw8RGrBZNbY5I0fA&utm_medium=api&utm_source=5731d18b&v=36C32F30732DE13F4DAF01F94C06F76683281972,adzuna,2026-04-05,False,False,False,False,False,True,False,False,False,False,False,False,False,False,False,,33708.48,£25k–£35k,Mid-level
176,Data Analyst,TXP Technology x People,"Surrey, South East England",Other UK,0,"Data Analyst (Junior to mid-level) Standard BPSS required to onboard Duration: 6 months Location: Remote working with 1 day per week in Redhill, Surrey £350.00 Per Day - Inside IR35 via Umbrella Our well established client in the consultancy space requires a UK based Data Analyst with experience of Data Manipulation and VB, to lead on planning data cut-over activities from Salesforce and SAP S/4HANA systems, into the customer's ERP system. The key area for the successful candidate will be stron…",78000.0,91000.0,2026-03-24T15:51:43Z,https://www.adzuna.co.uk/jobs/land/ad/5676943881?se=YOufHcQw8RGrBZNbY5I0fA&utm_medium=api&utm_source=5731d18b&v=D0B9D0E76333CEEFADA14C27D43AEB89A397C8A8,adzuna,2026-04-05,False,False,False,False,False,True,False,False,False,False,False,False,False,False,False,350.0,78000.0,£70k+,Mid-level
177,Data Analyst,INTEC SELECT LIMITED,"Reading, Berkshire",Other UK,0,"Data Analyst (HR Data / HRIS) Hybrid – Reading (2x PW) 6 Months (initial) SC Clearance Required The OpportunityAn exciting opportunity has arisen for an SC Cleared HR Data Analyst to join a high-profile organisation, playing a key role in transforming HR data into meaningful insight. The ideal candidate will have experience in HR or HR operations environment with exposure to HR data and systems (Workday, Oracle, SAP, SuccessFactors, iTrent, or similar).Our client is offering a day rate of £233.…",52000.0,65520.0,2026-03-30T15:26:07Z,https://www.adzuna.co.uk/jobs/land/ad/5683185588?se=YOufHcQw8RGrBZNbY5I0fA&utm_medium=api&utm_source=5731d18b&v=C7B89B68C33B842CA0FC2244D71581490DF7468C,adzuna,2026-04-05,False,False,False,False,False,True,False,False,False,False,False,False,False,False,False,233.0,52000.0,£50k–£70k,Mid-level
178,Data Analyst,Office Angels,"Bracknell, Berkshire",Other UK,0,"Office Angels are currently recruiting for a Data Analyst, for our client based in Bracknell, on a temporary basis. The Role: Data Analyst Hours: 9am - 5:30pm Hourly rate: £15.38ph Responsibilities: · Assist the regional marketing manager to analyse sales performance, market data, and customer insights to support decision making. · Provide forecasting support, including demand analysis and trend tracking. · Monitor competitor activity and market trends to support category planning. · Assist wit…",31990.0,31990.0,2026-03-09T13:15:49Z,https://www.adzuna.co.uk/jobs/land/ad/5659403468?se=YOufHcQw8RGrBZNbY5I0fA&utm_medium=api&utm_source=5731d18b&v=EA6A2ECBEBC51495A143BF7E0DBE37BCC0CA16F2,adzuna,2026-04-05,False,False,False,False,False,True,False,False,False,False,False,False,False,False,False,15000.0,31990.0,£25k–£35k,Mid-level
179,Data Analyst,Hays Specialist Recruitment Limited,"Gainsborough, Lincolnshire",Other UK,0,"Data Analyst - Own the Insight in a Complex ERP Transformation Gainsborough (3-4 days on site) £40-45,000 If you're the kind of Data Analyst who likes stepping into something new, figuring things out quickly, and becoming the person everyone turns to for clarity, this is the kind of role that will energise you from day one.You'll be joining at one of the most interesting moments in a business's life: a major ERP transformation heading towards go live. The data landscape is big, complex and full…",40000.0,45000.0,2026-03-26T22:12:41Z,https://www.adzuna.co.uk/jobs/land/ad/5679738950?se=YOufHcQw8RGrBZNbY5I0fA&utm_medium=api&utm_source=5731d18b&v=3C6A9ADBAC27004069F87693C8054A1EE3EA8329,adzuna,2026-04-05,False,False,False,False,False,True,False,False,False,False,False,False,False,False,False,40000.0,40000.0,£35k–£50k,Mid-level
180,Data Analyst (MHHS),FDM Group,"Coventry, West Midlands",Other UK,0,About The Role FDM is a global business and technology consultancy seeking a Data Analyst to work with our client in the Energy sector. This is an initial 6‑month contract with strong potential for extension and will operate as a hybrid role based in Coventry (1 day per week onsite). Our client is delivering a major regulatory change programme centred on Market Half Hourly Settlement (MHHS). This role provides the opportunity to play a key part in shaping and delivering data-led capabilities ac…,42206.22,42206.22,2026-02-25T12:57:14Z,https://www.adzuna.co.uk/jobs/land/ad/5644831009?se=YOufHcQw8RGrBZNbY5I0fA&utm_medium=api&utm_source=5731d18b&v=D7F987483A6EC021956BD3552C5E5D430F08436F,adzuna,2026-04-05,False,False,False,False,False,True,False,False,False,False,False,False,False,False,False,,42206.22,£35k–£50k,Mid-level
181,Business Data Analyst,FDM Group,"London, UK",London,0,"About The Role FDM is a global business and technology consultancy seeking a Business Data Analyst to work for our client within the Financial Services sector. This is initially a 6-month contract with the potential to extend and will be a hybrid role based in Cheshire East, Glasgow or Edinburgh. Our client is seeking a Business Data Analyst to support a project which focuses on implementing new regulatory reporting requirements being introduced by the regulators. Responsibilities: Gather and d…",49849.65,49849.65,2026-02-25T12:57:14Z,https://www.adzuna.co.uk/jobs/land/ad/5644831014?se=YOufHcQw8RGrBZNbY5I0fA&utm_medium=api&utm_source=5731d18b&v=0E905862E979C7D7A09E03AFCDBE0E5ADBC8AA71,adzuna,2026-04-05,False,False,False,False,False,True,False,False,False,False,False,False,False,False,False,,49849.65,£35k–£50k,Mid-level
182,Senior Data Analyst,FDM Group,"London, UK",London,0,"About The Role We are seeking a Senior Data Analyst to join our clients Data & Analytics team. This role is ideal for someone with a strong technical foundation, a passion for solving complex problems, and a deep understanding of financial and client behavioural data. You will be responsible for delivering high-impact data analysis, automating reporting processes, and implementing scalable solutions that support strategic decision-making across financial advisory services that support their UK …",63907.88,63907.88,2026-02-24T12:51:04Z,https://www.adzuna.co.uk/jobs/land/ad/5643639435?se=YOufHcQw8RGrBZNbY5I0fA&utm_medium=api&utm_source=5731d18b&v=9740C7BECC401E9C1518F3B84E3027F948DAC1C9,adzuna,2026-04-05,False,False,False,False,False,True,False,False,False,False,False,False,False,False,False,,63907.88,£50k–£70k,Senior
183,Data Analyst L4,wipro ltd,"Warwick, Warwickshire",Other UK,0,"Wipro Limited (NYSE: WIT, BSE: 507685, NSE: WIPRO) is a leading technology services and consulting company focused on building innovative solutions that address clients’ most complex digital transformation needs. Leveraging our holistic portfolio of capabilities in consulting, design, engineering, and operations, we help clients realize their boldest ambitions and build future-ready, sustainable businesses. With over 230,000 employees and business partners across 65 countries, we deliver on the…",45780.83,45780.83,2026-02-25T12:57:14Z,https://www.adzuna.co.uk/jobs/land/ad/5644831013?se=YOufHcQw8RGrBZNbY5I0fA&utm_medium=api&utm_source=5731d18b&v=9C133A254E36A189ECDDCC30DF99EF8834104B8F,adzuna,2026-04-05,False,False,False,False,False,True,False,False,False,False,False,False,False,False,False,,45780.83,£35k–£50k,Mid-level
184,Data Analyst,Creditsafe,"Cardiff County, Wales",Other UK,0,"We are currently looking Data Analyst, to work in our Cardiff Bay office. You will be expected to attend the office 50% of the working week, to align with our hybrid working policy. WHO ARE WE? At Creditsafe, we weave our core values of customer-obsession, trust, respect and the courage to be different into the very fabric of our culture. With these values, we’ve fostered a culture of growth, innovation, well-being and success for the last 20 years at Creditsafe and created a legacy of successf…",39383.96,39383.96,2026-03-13T15:44:25Z,https://www.adzuna.co.uk/jobs/land/ad/5663594007?se=YOufHcQw8RGrBZNbY5I0fA&utm_medium=api&utm_source=5731d18b&v=1E8AA90CE0899C3C4721594DD9C5B872CA19B80C,adzuna,2026-04-05,False,False,False,False,False,True,False,False,False,False,False,False,False,False,False,,39383.96,£35k–£50k,Mid-level
185,Data Analyst,Adria Solutions,"Glossop, Derbyshire",Other UK,0,"Data Analyst We are looking for a Data Analyst to improve data quality, governance, and availability across the business. You will help create “gold” datasets, establish lightweight governance, and automate quality checks to support accurate, trusted reporting. Key Responsibilities Inventory and profile existing data sources (apps, databases, files, SaaS). Design and implement data cleansing and standardisation pipelines. Maintain data dictionaries, lineage diagrams, and semantic layers. Establ…",40000.0,50000.0,2026-04-02T15:55:51Z,https://www.adzuna.co.uk/jobs/land/ad/5687576777?se=YOufHcQw8RGrBZNbY5I0fA&utm_medium=api&utm_source=5731d18b&v=1CFE98C216C7A4146315E19EBEFEA4B27850F40E,adzuna,2026-04-05,False,False,False,False,False,True,False,False,False,False,False,False,False,False,False,,40000.0,£35k–£50k,Mid-level
186,Assistant Programme Manager/Policy Data Analyst,MCS Group,"Belfast, Northern Ireland",Other UK,0,"MCS Group has a temporary post available for an Assistant Programme Manager / Policy Data Analyst . This professional will join a key public body within the Planning, Performance, and Corporate Services Directorate, primarily based in Belfast. You will use your expertise in data analytics to manage the development and delivery of complex statistical reports for both emergency and corporate activity. This role is vital in providing specialist interpretation of information for Executive Directors…",34242.0,34242.0,2026-04-02T20:36:35Z,https://www.adzuna.co.uk/jobs/land/ad/5687661651?se=YOufHcQw8RGrBZNbY5I0fA&utm_medium=api&utm_source=5731d18b&v=229803910769598C5696D389DB4CEBAE27FEF1C3,adzuna,2026-04-05,False,False,False,False,False,True,False,False,False,False,False,False,False,False,False,,34242.0,£25k–£35k,Mid-level
187,Lead Data Analyst - Operations,Wise,"London, UK",London,0,"Wise is a global technology company, building the best way to move and manage the world’s money. Min fees. Max ease. Full speed. Whether people and businesses are sending money to another country, spending abroad, or making and receiving international payments, Wise is on a mission to make their lives easier and save them money. As part of our team, you will be helping us create an entirely new network for the worlds money. For everyone, everywhere. Job Description We’re looking for an Lead Dat…",57389.51,57389.51,2026-03-25T15:39:40Z,https://www.adzuna.co.uk/jobs/land/ad/5678131768?se=YOufHcQw8RGrBZNbY5I0fA&utm_medium=api&utm_source=5731d18b&v=50217C32633F47442FAB5F6A800EBA3732A51420,adzuna,2026-04-05,False,False,False,False,False,True,False,False,False,False,False,False,False,False,False,,57389.51,£50k–£70k,Senior
188,Data Analyst - London,ATG Entertainment,"London, UK",London,0,"Data Analyst - London Data Analyst This is a hybrid role based in London (Shaftesbury Avenue), with an expectation of 2 days per week in the office. You'll report to the Analytics Manager within our Marketing Analytics & Data Science team and work closely with other data professionals as well as stakeholders in CRM, Memberships, Ticketing and Regional Marketing. We are looking for a Data Analyst to join us and help drive business value by delivering insights & recommendations which lead to data…",35000.0,45000.0,2026-04-04T10:43:06Z,https://www.adzuna.co.uk/jobs/land/ad/5689738364?se=YOufHcQw8RGrBZNbY5I0fA&utm_medium=api&utm_source=5731d18b&v=0EFF61CAB505F8646839129665513376B2F4F993,adzuna,2026-04-05,False,False,False,False,False,True,False,False,False,False,False,False,False,False,False,,35000.0,£35k–£50k,Mid-level
189,Trainee Data Analyst,ITOL Recruit,"Barking, Essex",Other UK,0,"Are you looking to benefit from a new career in Data Analysis? If you are detail orientated, perceptive, organised, competent, analytical and can communicate well with those around you; you could have a truly rewarding future as a Data Analyst We do this using our specialised Data Analyst career programme which looks to assist and place qualified candidates into a career pathway in Data Analysis. Please note this career program is designed for entry level individuals with limited or no experien…",30000.0,50000.0,2026-03-16T13:44:47Z,https://www.adzuna.co.uk/jobs/land/ad/5668632083?se=YOufHcQw8RGrBZNbY5I0fA&utm_medium=api&utm_source=5731d18b&v=F68AF73394992E748554C89C5802C87773804ACB,adzuna,2026-04-05,False,False,False,False,False,True,False,False,False,False,False,False,False,False,False,,30000.0,£25k–£35k,Junior
190,Finance Data Analyst,Tio Talent Ltd,"Runcorn, Cheshire",Other UK,0,"Finance Data Analyst - Runcorn (Full-Time, Office-Based) £27,000 - £30,000 per annum DOE We are currently recruiting for a Finance Data Analyst to join a fast-growing, dynamic business based near Runcorn in Cheshire. This is an excellent opportunity for a detail-oriented and analytical individual looking to develop their career in a Finance Data Analyst role within a supportive and collaborative environment. As a Finance Data Analyst, you will play a key role in collecting, organising, and anal…",27000.0,30000.0,2026-03-30T15:26:43Z,https://www.adzuna.co.uk/jobs/land/ad/5683185691?se=HCGyHsQw8RGrBZNbY5I0fA&utm_medium=api&utm_source=5731d18b&v=75879ECACF60FA55D9E20F0E249421DA75736A57,adzuna,2026-04-05,False,False,False,True,False,True,False,False,False,False,False,False,False,False,False,27000.0,27000.0,£25k–£35k,Mid-level
191,Data Analyst SystmOne,Hays Specialist Recruitment Limited,"Leeds, West Yorkshire",Leeds,0,"Data Analyst (SystmOne) - Inside IR35 - £300 per day - Part-Time Location: Onsite 2 days per week (West Yorkshire) Rate: £250 - £300 per day (Inside IR35) Contract: Interim (3 months)/ Contract Working Pattern: Part-time (3 days), with a minimum of 2 days onsite Clearance: DBS required Your New Company A respected Public Sector Organisation delivering vital community and healthcare-related services is seeking interim data support to cover a key Data Analyst position. This organisation works clo…",65000.0,78000.0,2026-03-12T21:33:05Z,https://www.adzuna.co.uk/jobs/land/ad/5662939279?se=HCGyHsQw8RGrBZNbY5I0fA&utm_medium=api&utm_source=5731d18b&v=1895D41A2B97AC7CF0C2344E71744E86264F13DC,adzuna,2026-04-05,False,False,False,False,False,True,False,False,False,False,False,False,False,False,False,300.0,65000.0,£50k–£70k,Mid-level
192,Data Analyst Apprentice,QA,"Newcastle Upon Tyne, Tyne & Wear",Other UK,0,"Apprentices are in demand. Like the sound of translating data from chunks of numbers into plain, understandable language? Interested in joining the innovative world of data and data analytics? Our Data Analyst Apprenticeship is your route into a rewarding career. You’ll gain on-the-job experience, earn a salary, and receive all your training at no cost to you. With our career progression pathways, you can take your learning as far as you want – all the way from a Level 3 apprenticeship to a Bac…",20000.0,22000.0,2026-03-12T13:35:15Z,https://www.adzuna.co.uk/jobs/land/ad/5662365586?se=HCGyHsQw8RGrBZNbY5I0fA&utm_medium=api&utm_source=5731d18b&v=6F36314794F55A9E050E767B70375210CCD777E7,adzuna,2026-04-05,False,False,False,False,False,True,False,False,False,False,False,False,False,False,False,,20000.0,Under £25k,Mid-level
193,Data Analyst - Product,Harnham - Data & Analytics Recruitment,"London, UK",London,0,"Data Analyst Fully remoteUp to 55,000  bonus  equity This is an exciting opportunity to join a high-growth consumer platform at a pivotal moment as they scale their modern data function. You will have real ownership, the chance to shape analytical best practice, and the freedom to influence product strategy through high-impact insights. The Company They are a fast-growing digital subscription platform with a strong, mission-driven culture and an engaged global user base. The business has recent…",45000.0,55000.0,2026-03-12T21:33:09Z,https://www.adzuna.co.uk/jobs/land/ad/5662939472?se=HCGyHsQw8RGrBZNbY5I0fA&utm_medium=api&utm_source=5731d18b&v=8A1761855FD8AB7D5759149F4951B098BB75F714,adzuna,2026-04-05,False,False,False,False,False,True,False,False,False,False,False,False,False,False,False,,45000.0,£35k–£50k,Mid-level
194,Lead Data Analyst,Harnham - Data & Analytics Recruitment,"London, UK",London,0,"Lead Data Analyst London, Hybrid (1-2x per week) Up to £65,000 This is an exciting opportunity to join a high-growth organisation where data science directly shapes performance marketing strategy. You will lead a growing data science function, drive long-term analytical programmes, and play a key role in delivering meaningful commercial impact for well-known consumer brands. The Company They are a specialist performance marketing and technology business known for combining deep analytical exper…",55000.0,65000.0,2026-03-26T22:12:52Z,https://www.adzuna.co.uk/jobs/land/ad/5679739450?se=HCGyHsQw8RGrBZNbY5I0fA&utm_medium=api&utm_source=5731d18b&v=35AE1AE05C6068D271BCE770B20736C9EFF7DC7D,adzuna,2026-04-05,False,False,False,False,False,True,False,False,False,False,False,False,False,False,False,65000.0,55000.0,£50k–£70k,Senior
195,Lead Data Analyst,Tenth Revolution Group,"London, UK",London,0,"Lead Data Analyst Up to £80,000  Bonus About the Role I am currently recruiting for a Lead Data Analyst to support the delivery of data and analytics transformation programmes within a global technology consulting organisation. Working across a variety of enterprise and public sector clients, this role sits between business strategy, data platforms and analytical delivery. You will lead teams responsible for delivering modern analytics solutions, data platforms and reporting capabilities built …",70000.0,80000.0,2026-03-13T13:31:25Z,https://www.adzuna.co.uk/jobs/land/ad/5663509257?se=HCGyHsQw8RGrBZNbY5I0fA&utm_medium=api&utm_source=5731d18b&v=7B6B92FF0248EA34C601550017DE5A10062137DE,adzuna,2026-04-05,False,False,False,False,False,True,False,False,False,False,False,False,False,False,False,80000.0,70000.0,£70k+,Senior
196,Commercial Data Analyst,MSA Data Analytics Ltd,"Marton-In-Cleveland, Middlesbrough",Other UK,0,"This exciting opportunity will provide key analytical support to a fast-paced commercial function, delivering forecast appraisals, insight and strategic direction to ensure the business remains competitive. As a Commercial Analyst, you will analyse multiple data sources and generate strategic insights to drive efficiency and optimisation, while providing finance teams with commercial MI to support planning and growth initiatives. Specifically, you will be responsible for performing the followin…",49670.69,49670.69,2026-03-19T02:14:41Z,https://www.adzuna.co.uk/jobs/land/ad/5671548980?se=HCGyHsQw8RGrBZNbY5I0fA&utm_medium=api&utm_source=5731d18b&v=9C8CBBFFBC579DF5EAE5BE05A2031E8A433AB76B,adzuna,2026-04-05,False,False,False,False,False,True,False,False,False,False,False,False,False,False,False,,49670.69,£35k–£50k,Mid-level
197,Revenue Data Analyst - Newport,The Celtic Collection,"Newport, Wales",Other UK,0,"JOB TITLE: Revenue Data Analyst DEPARTMENT: Sales and Revenue CONTRACT TYPE: Temporary – Maternity Cover RATE OF PAY: £12.42 per hour  excellent benefits HOURS: 37.5 hours over 5 days LOCATION: Newport, NP18 1HQ ID: REQ5918 Are You a Data Enthusiast with a Passion for Hospitality? Join the award-winning Celtic Manor Resort and become a key player in our Sales and Revenue team. We’re looking for a Revenue Data Analyst who thrives on uncovering insights, spotting trends, and turning numbers into …",38696.31,38696.31,2026-04-01T10:30:36Z,https://www.adzuna.co.uk/jobs/land/ad/5685259995?se=HCGyHsQw8RGrBZNbY5I0fA&utm_medium=api&utm_source=5731d18b&v=25D8A27DF298103BA0F7E81C4721110A3E40C130,adzuna,2026-04-05,False,False,False,True,False,True,False,False,False,False,False,False,False,False,False,12000.0,38696.31,£35k–£50k,Mid-level
198,Junior / Trainee Data Analyst,GET STAFFED ONLINE RECRUITMENT LIMITED,"Warwickshire, West Midlands",Other UK,0,"Junior / Trainee Data Analyst Salary: £25,000 – £30,000 Location: Alcester (Hybrid) Our client is a technology-focused Mortgage Network, offering support services to Mortgage and Protection Advisers. Their goal is to continue to be the best home for Mortgage Advisers, Protection Specialists, Equity Release Experts and General Insurance Professionals, whatever their size or location, using market-leading technology. Key Responsibilities: Create, maintain, and enhance reporting solutions that pro…",25000.0,30000.0,2026-03-21T09:10:12Z,https://www.adzuna.co.uk/jobs/land/ad/5674081548?se=HCGyHsQw8RGrBZNbY5I0fA&utm_medium=api&utm_source=5731d18b&v=E53D4726FBA13CD47B08CFC66D079F775FAD036E,adzuna,2026-04-05,False,False,False,False,False,True,False,False,False,False,False,False,False,False,False,25000.0,25000.0,£25k–£35k,Junior
199,Data Analyst / Systems Analyst - Immediate Start!,MCS Group,"Banbridge, County Down",Other UK,0,"MCS Group is working with an established and growing manufacturing company in County Down as they look for a detail-oriented Data Analyst / Systems Analyst to support the implementation and optimisation of a new production and stock control system. This is an excellent opportunity for a Data Analyst or Systems Analyst who enjoys working with complex data, systems, and operational processes within a manufacturing environment. The Role This Data Analyst / Systems Analyst will help to build out th…",45000.0,45000.0,2026-03-13T03:40:38Z,https://www.adzuna.co.uk/jobs/land/ad/5663148378?se=HCGyHsQw8RGrBZNbY5I0fA&utm_medium=api&utm_source=5731d18b&v=DC630EED3A4633CE946F223842ED4579693C6204,adzuna,2026-04-05,False,False,False,True,False,True,False,False,False,False,False,False,False,False,False,,45000.0,£35k–£50k,Mid-level
200,Maintenance Data Analyst,Belcan,"Southampton, Hampshire",Other UK,0,"Maintenance Data Analyst – Southampton (Onsite) Belcan Workforce Solutions are seeking a Maintenance Data Analyst to support a high-performing Maintenance function within a complex operational environment. This role is ideal for someone with strong maintenance understanding, analytical skills, and experience working with maintenance systems or data. Key Responsibilities • Produce maintenance cost reports and performance metrics • Develop and maintain Power BI dashboards • Prepare financial accr…",74665.45,74665.45,2026-04-02T14:57:01Z,https://www.adzuna.co.uk/jobs/land/ad/5687539243?se=HCGyHsQw8RGrBZNbY5I0fA&utm_medium=api&utm_source=5731d18b&v=B558B40CBC7881F0A1304DCB03A4A42FC89D6304,adzuna,2026-04-05,False,False,True,False,False,True,False,False,False,False,False,False,False,False,False,,74665.45,£70k+,Mid-level
