id,title,company,location,region,is_remote,description,min_amount,max_amount,date_posted,job_url,site,scraped_date,Python,SQL,Power BI,Excel,Tableau,R,Azure,AWS,Spark,Machine Learning,pandas,NumPy,Looker,dbt,Snowflake,parsed_salary,salary,salary_band,seniority
173,Data Analyst,Fieldfisher,"Belfast, Northern Ireland",Other UK,0,"The Vacancy We are a multinational law firm headquartered in London, with most of our data estate based on Microsoft technologies. We have just started our transition from on premise SQL Servers and SSIS to Azure SQL, Fabric and Power BI. To build and support these new platforms, we are expanding our data team with more data engineers and data analysts. The data engineering team is led by the Senior Data Engineer and reports to the IT Development Manager. Role and Responsibilities Power BI - Re…",32069.81,32069.81,2026-04-03T08:53:48Z,https://www.adzuna.co.uk/jobs/land/ad/5688405650?se=1O0v8yEz8RGKnukZYnzAng&utm_medium=api&utm_source=5731d18b&v=CBACA40F27A8770C784BF6CCB708759D6BE09EE3,adzuna,2026-04-08,False,True,True,False,False,True,True,False,False,False,False,False,False,False,False,,32069.81,£25k–£35k,Mid-level
174,Data Analyst,Reed,"Manchester, Greater Manchester",Manchester,0,"Data Analyst £34,434 - £38,220 per annum Hybrid with 1 day per week on-site in Greater Manchester Join our dedicated team in the Children & Young People's Directorate, where we are committed to using data and intelligence to inform decision-making and shape organisational policy, strategy, and priorities. This role is crucial in supporting the Senior Data Analyst and engaging with stakeholders to enhance our services. Day-to-Day Responsibilities: Analyse and report on data to shape decision-mak…",34434.0,38220.0,2026-04-08T01:59:32Z,https://www.adzuna.co.uk/jobs/land/ad/5692512843?se=1O0v8yEz8RGKnukZYnzAng&utm_medium=api&utm_source=5731d18b&v=B52B46C0B4C73601DCD270F6F559A4086286C43B,adzuna,2026-04-08,False,False,False,False,False,True,False,False,False,False,False,False,False,False,False,34434.0,34434.0,£25k–£35k,Mid-level
175,Data Analyst,Total Assist Recruitment,"County Antrim, Northern Ireland",Other UK,0,"Interviews started Job Summary The post holder will be responsible for managing the development, production and delivery of complex statistical and qualitative and/or quantitative reports for emergency and non-emergency or corporate activity based information for Executive Directors, Senior Managers and external Health and Social Care Organisations or agencies as required. He/she will provide specialist knowledge in interpretation and analysis of information and definition of reporting/informat…",27040.0,27040.0,2026-04-08T01:57:31Z,https://www.adzuna.co.uk/jobs/land/ad/5692510047?se=1O0v8yEz8RGKnukZYnzAng&utm_medium=api&utm_source=5731d18b&v=ADF3EFB1C7872333D64A43302DF16CE7072EF552,adzuna,2026-04-08,False,False,False,False,False,True,False,False,False,False,False,False,False,False,False,,27040.0,£25k–£35k,Mid-level
176,Data Analyst,C4S Search Ltd,"Cirencester, Gloucestershire",Other UK,0,"JOB TITLE: Data Engineer LOCATION: Cirencester SALARY: £28,000 - £30,000 WAY OF WORKING: Full Time | Hybrid | Permanent THE BUSINESS: C4S Search are pleased to be working with a well-established and fast-growing SaaS company. THE DATA ENGINEER OPPORTUNITY: Take ownership of data quality, structure, and consistency across multiple products and sources Build processes and tooling to monitor, measure, and report on data integrity Develop and improve data pipelines and flows into SQL Server to supp…",28000.0,35000.0,2026-04-08T01:54:06Z,https://www.adzuna.co.uk/jobs/land/ad/5692505158?se=1O0v8yEz8RGKnukZYnzAng&utm_medium=api&utm_source=5731d18b&v=583177DE4DF19E249A8AB1234DF14BADE93BA226,adzuna,2026-04-08,False,True,False,False,False,True,False,False,False,False,False,False,False,False,False,28000.0,28000.0,£25k–£35k,Mid-level
177,Trainee Data Analyst,ITOL Recruit,"Bromley, South East London",London,0,"Are you looking to benefit from a new career in Data Analysis? If you are detail orientated, perceptive, organised, competent, analytical and can communicate well with those around you; you could have a truly rewarding future as a Data Analyst We do this using our specialised Data Analyst career programme which looks to assist and place qualified candidates into a career pathway in Data Analysis. Please note this career program is designed for entry level individuals with limited or no experien…",30000.0,50000.0,2026-03-16T13:51:58Z,https://www.adzuna.co.uk/jobs/land/ad/5668637485?se=1O0v8yEz8RGKnukZYnzAng&utm_medium=api&utm_source=5731d18b&v=EAA22F87405EAD109562A552157A0075CD377816,adzuna,2026-04-08,False,False,False,False,False,True,False,False,False,False,False,False,False,False,False,,30000.0,£25k–£35k,Junior
178,Finance Data Analyst,Tio Talent Ltd,"Runcorn, Cheshire",Other UK,0,"Finance Data Analyst - Runcorn (Full-Time, Office-Based) £27,000 - £30,000 per annum DOE We are currently recruiting for a Finance Data Analyst to join a fast-growing, dynamic business based near Runcorn in Cheshire. This is an excellent opportunity for a detail-oriented and analytical individual looking to develop their career in a Finance Data Analyst role within a supportive and collaborative environment. As a Finance Data Analyst, you will play a key role in collecting, organising, and anal…",27000.0,30000.0,2026-03-30T15:26:43Z,https://www.adzuna.co.uk/jobs/land/ad/5683185691?se=PJFk9CEz8RGFqquviAJvug&utm_medium=api&utm_source=5731d18b&v=75879ECACF60FA55D9E20F0E249421DA75736A57,adzuna,2026-04-08,False,False,False,True,False,True,False,False,False,False,False,False,False,False,False,27000.0,27000.0,£25k–£35k,Mid-level
179,Data Analyst SystmOne,Hays Specialist Recruitment Limited,"Huddersfield, West Yorkshire",Other UK,0,"Data Analyst (SystmOne) - Inside IR35 - £250.00 per day - Part-Time 2 days (2 days on site in Huddersfield ) Location: Onsite 2 days per week (West Yorkshire) Rate: £250 per day (Inside IR35) Contract: Interim / Contract Working Pattern: Part-time (2 days), with 2 days onsite Clearance: Enhanced DBS required Your New Company A respected Public Sector Organisation delivering vital community and healthcare-related services is seeking interim data support to cover a key Data Analyst position. This…",65000.0,65000.0,2026-03-30T23:35:43Z,https://www.adzuna.co.uk/jobs/land/ad/5683631815?se=PJFk9CEz8RGFqquviAJvug&utm_medium=api&utm_source=5731d18b&v=00363140C869CB2F3D0F7040296B4E1A135E0C91,adzuna,2026-04-08,False,False,False,False,False,True,False,False,False,False,False,False,False,False,False,250.0,65000.0,£50k–£70k,Mid-level
180,HR Data Analyst,Morgan Hunt Recruitment,"Leeds, West Yorkshire",Leeds,0,"Junior HR Data AnalystLeeds (1 day per month on-site)£26,000 - £29,000 per annumUntil November 2026The OpportunityWe're looking for a detail-oriented HR Data Analyst to join a major transformation programme, supporting the implementation of a modern HR landscape including platforms such as SAP S/4HANA, SuccessFactors, Oracle, or iTrent.This is a fantastic opportunity to work at the heart of a large-scale systems upgrade, ensuring data is accurate, consistent, and fit for purpose as it moves int…",26000.0,29000.0,2026-03-26T05:55:21Z,https://www.adzuna.co.uk/jobs/land/ad/5678889708?se=PJFk9CEz8RGFqquviAJvug&utm_medium=api&utm_source=5731d18b&v=FDAE3A28810ABB65F43881083858647934B17E93,adzuna,2026-04-08,False,False,False,False,False,True,False,False,False,False,False,False,False,False,False,26000.0,26000.0,£25k–£35k,Mid-level
181,Data Analyst Apprentice,QA,"Newcastle Upon Tyne, Tyne & Wear",Other UK,0,"Apprentices are in demand. Like the sound of translating data from chunks of numbers into plain, understandable language? Interested in joining the innovative world of data and data analytics? Our Data Analyst Apprenticeship is your route into a rewarding career. You’ll gain on-the-job experience, earn a salary, and receive all your training at no cost to you. With our career progression pathways, you can take your learning as far as you want – all the way from a Level 3 apprenticeship to a Bac…",20000.0,22000.0,2026-03-12T13:35:15Z,https://www.adzuna.co.uk/jobs/land/ad/5662365586?se=PJFk9CEz8RGFqquviAJvug&utm_medium=api&utm_source=5731d18b&v=6F36314794F55A9E050E767B70375210CCD777E7,adzuna,2026-04-08,False,False,False,False,False,True,False,False,False,False,False,False,False,False,False,,20000.0,Under £25k,Mid-level
182,Data Analyst - Product,Harnham - Data & Analytics Recruitment,"London, UK",London,0,"Data Analyst Fully remoteUp to 55,000  bonus  equity This is an exciting opportunity to join a high-growth consumer platform at a pivotal moment as they scale their modern data function. You will have real ownership, the chance to shape analytical best practice, and the freedom to influence product strategy through high-impact insights. The Company They are a fast-growing digital subscription platform with a strong, mission-driven culture and an engaged global user base. The business has recent…",45000.0,55000.0,2026-03-12T21:33:09Z,https://www.adzuna.co.uk/jobs/land/ad/5662939472?se=PJFk9CEz8RGFqquviAJvug&utm_medium=api&utm_source=5731d18b&v=8A1761855FD8AB7D5759149F4951B098BB75F714,adzuna,2026-04-08,False,False,False,False,False,True,False,False,False,False,False,False,False,False,False,,45000.0,£35k–£50k,Mid-level
183,Business Data Analyst,Jonathan Lee Recruitment,UK,Other UK,0,"Are you ready to take your career to the next level? This exciting opportunity as a Business Data Analyst offers the chance to make a real impact in a dynamic and fast-paced environment. With a focus on driving scalable lead acquisition, qualification, and conversion, this role is perfect for someone looking to work on innovative projects that shape the future of business strategies. As a part of this position, you will collaborate with cross-functional teams, dive into data analysis, and optim…",45000.0,45000.0,2026-03-18T15:57:19Z,https://www.adzuna.co.uk/jobs/land/ad/5670804767?se=PJFk9CEz8RGFqquviAJvug&utm_medium=api&utm_source=5731d18b&v=AAFE15EBB3BB1DB5884C6DA1F3ECA87950D12547,adzuna,2026-04-08,False,False,False,False,False,True,False,False,False,False,False,False,False,False,False,,45000.0,£35k–£50k,Mid-level
184,Lead Data Analyst,Tenth Revolution Group,"London, UK",London,0,"Lead Data Analyst Up to £80,000  Bonus About the Role I am currently recruiting for a Lead Data Analyst to support the delivery of data and analytics transformation programmes within a global technology consulting organisation. Working across a variety of enterprise and public sector clients, this role sits between business strategy, data platforms and analytical delivery. You will lead teams responsible for delivering modern analytics solutions, data platforms and reporting capabilities built …",70000.0,80000.0,2026-03-13T13:31:25Z,https://www.adzuna.co.uk/jobs/land/ad/5663509257?se=PJFk9CEz8RGFqquviAJvug&utm_medium=api&utm_source=5731d18b&v=7B6B92FF0248EA34C601550017DE5A10062137DE,adzuna,2026-04-08,False,False,False,False,False,True,False,False,False,False,False,False,False,False,False,80000.0,70000.0,£70k+,Senior
185,Commercial Data Analyst,MSA Data Analytics Ltd,"Marton-In-Cleveland, Middlesbrough",Other UK,0,"This exciting opportunity will provide key analytical support to a fast-paced commercial function, delivering forecast appraisals, insight and strategic direction to ensure the business remains competitive. As a Commercial Analyst, you will analyse multiple data sources and generate strategic insights to drive efficiency and optimisation, while providing finance teams with commercial MI to support planning and growth initiatives. Specifically, you will be responsible for performing the followin…",49670.69,49670.69,2026-03-19T02:14:41Z,https://www.adzuna.co.uk/jobs/land/ad/5671548980?se=PJFk9CEz8RGFqquviAJvug&utm_medium=api&utm_source=5731d18b&v=9C8CBBFFBC579DF5EAE5BE05A2031E8A433AB76B,adzuna,2026-04-08,False,False,False,False,False,True,False,False,False,False,False,False,False,False,False,,49670.69,£35k–£50k,Mid-level
186,Senior Data Analyst,FDM Group,"London, UK",London,0,"Have you had a career break of 12 months? Do you have 5 years of commercial experience, including hands-on experience in Data, Analytics, or related technology roles? Are you ready to re-join the workforce with structured training, support and career coaching included? Then you’ll want to hear about the UK’s leading Returners Programme and the opportunities to join our Data & Analytics Practice . Our Returners Programme is specifically designed to support professionals returning to work after a…",48177.81,48177.81,2026-03-24T15:46:50Z,https://www.adzuna.co.uk/jobs/land/ad/5676938785?se=PJFk9CEz8RGFqquviAJvug&utm_medium=api&utm_source=5731d18b&v=369082D221FE3F13028A55E420EFB2A71CC4BE2D,adzuna,2026-04-08,False,False,False,False,False,True,False,False,False,False,False,False,False,False,False,,48177.81,£35k–£50k,Senior
187,Senior Data Analyst,VANRATH,"Antrim, County Antrim",Other UK,0,"DATA ANALYST - HYBRID VANRATH are delighted to be recruiting for an exciting opportunity with one of our large Public Sector Clients. You will be responsible for managing the development, production and delivery of comlex statistical and qualitative and/or quantitative reports. This role is approx for a 12 month period (possible extension after this), and should be seen as an excellent chance to get your foot in the door for a permanent role or other contracts. It also offers Hybrid working (af…",35000.0,35000.0,2026-03-12T12:32:13Z,https://www.adzuna.co.uk/jobs/land/ad/5662344520?se=PJFk9CEz8RGFqquviAJvug&utm_medium=api&utm_source=5731d18b&v=374A044C2FF63AB73772A00C23F31DB880FDA017,adzuna,2026-04-08,False,False,False,True,False,True,False,False,False,False,False,False,False,False,False,,35000.0,£35k–£50k,Senior
188,Business Data Analyst,Wellington Professional Recruitment,"Belfast, Northern Ireland",Other UK,0,"Business Data Analyst Our Public Body Client requires a Property Business Data Analyst to join their Property & Estates Division , where you will play a key role in improving information management, business intelligence, and data-driven decision-making across the division. This role will support the deployment of best practice in data analysis, reporting, and digital solutions to enhance service delivery for both internal and external stakeholders. You will work closely with property, asset ma…",50000.0,50000.0,2026-03-26T04:03:23Z,https://www.adzuna.co.uk/jobs/land/ad/5678824411?se=PJFk9CEz8RGFqquviAJvug&utm_medium=api&utm_source=5731d18b&v=83690547EBAB9EC8A216186247032DDDD2CCB9A7,adzuna,2026-04-08,False,False,False,False,False,True,False,False,False,False,False,False,False,False,False,,50000.0,£50k–£70k,Mid-level
189,Data Analyst Trainee,Newto Training,"London, UK",London,0,"Are you ready to start a new career in Data Analysis? The demand for Data Analysts has grown by 20% annually, with experienced professionals earning salaries upwards of £58,000. In today’s digital world, data is critical to business decision-making, making the role of a Data Analyst indispensable. As skills shortages continue to grow, the demand for qualified entry-level professionals is on the rise. With our Data Analytics career programme we will provide you with: 8 training modules: Excel, S…",25000.0,78000.0,2026-04-08T03:23:42Z,https://www.adzuna.co.uk/jobs/land/ad/5692688518?se=PJFk9CEz8RGFqquviAJvug&utm_medium=api&utm_source=5731d18b&v=74FCE8B1FAE307BA9A85652F8D53F1AA5CF6C7EF,adzuna,2026-04-08,False,False,False,True,False,True,False,False,False,False,False,False,False,False,False,58000.0,25000.0,£25k–£35k,Junior
190,Graduate Data Analyst,Ashdown Group,"Dartford, Kent",Other UK,0,"A well-established business is looking for a Graduate Data Analyst to join its team, based in Dartford, Kent. Please note that this role requires the chosen candidate to be based in the office 5 days per week.In order to be suitable for this role, you must be experienced in analysing data and producing complex reports using a variety of report writing technologies. The successful candidate must have a deep knowledge of SQL databases, while any prior experience using Power BI and/or SSRS would b…",25000.0,30000.0,2026-04-08T02:02:41Z,https://www.adzuna.co.uk/jobs/land/ad/5692515761?se=PJFk9CEz8RGFqquviAJvug&utm_medium=api&utm_source=5731d18b&v=932DC6E392F36896C94DBBE9D5874C6E11871347,adzuna,2026-04-08,False,True,True,False,False,True,False,False,False,False,False,False,False,False,False,,25000.0,£25k–£35k,Junior
191,Marketing Data Analyst,Harnham - Data & Analytics Recruitment,"London, UK",London,0,"Marketing Data Analyst London - hybrid - 4 days per week onsiteUp to £50,000 This is a great opportunity to join a data driven marketing environment where you will help major consumer brands understand their customers, optimise digital campaigns, and use data to drive measurable commercial impact. If you enjoy solving problems, working closely with clients, and telling stories through data, this role offers both variety and real influence. The Company They are a well-established marketing and t…",40000.0,50000.0,2026-04-08T01:55:25Z,https://www.adzuna.co.uk/jobs/land/ad/5692506876?se=PJFk9CEz8RGFqquviAJvug&utm_medium=api&utm_source=5731d18b&v=531005975C4CF8F80FC2CF2A31D2A51B41288DAF,adzuna,2026-04-08,False,False,False,False,False,True,False,False,False,False,False,False,False,False,False,50000.0,40000.0,£35k–£50k,Mid-level
192,Trainee Data Analyst,Newto Training,UK,Other UK,0,"Are you ready to start a new career in Data Analysis? The demand for Data Analysts has grown by 20% annually, with experienced professionals earning salaries upwards of £58,000. In today’s digital world, data is critical to business decision-making, making the role of a Data Analyst indispensable. As skills shortages continue to grow, the demand for qualified entry-level professionals is on the rise. With our Data Analytics career programme we will provide you with: 8 training modules: Excel, S…",25000.0,78000.0,2026-04-08T04:29:39Z,https://www.adzuna.co.uk/jobs/land/ad/5692750310?se=PJFk9CEz8RGFqquviAJvug&utm_medium=api&utm_source=5731d18b&v=36BF462D63732ABCB1AF9BC3DAD39E41F133D030,adzuna,2026-04-08,False,False,False,True,False,True,False,False,False,False,False,False,False,False,False,58000.0,25000.0,£25k–£35k,Junior
193,Quality Data Analyst,Latitude Recruitment,"Portsmouth, Hampshire",Other UK,0,"Our clients based closed to Portsmouth have an exciting opportunity for a Quality Data Analyst to join their growing team. The Quality Systems Analyst is responsible for the development, automation, and maintenance of QMS nonconformance reporting and analytics, with a strong focus on trend analysis, root cause identification, and Cost of Quality (CoQ) insight. This role supports the business by transforming quality data into actionable intelligence, enabling the identification of key improvemen…",45000.0,45000.0,2026-03-19T09:20:19Z,https://www.adzuna.co.uk/jobs/land/ad/5671796499?se=PJFk9CEz8RGFqquviAJvug&utm_medium=api&utm_source=5731d18b&v=850D367F7E3D2593DA3B7F7B21EFD9D687218D84,adzuna,2026-04-08,False,False,False,False,False,True,False,False,False,False,False,False,False,False,False,,45000.0,£35k–£50k,Mid-level
194,Data Analyst,Lusona Consultancy,UK,Other UK,0,"Job Title : Business Systems & Data Analyst Job Location: York or East Kilbride Job Salary: Up to £50,000  benefits Hybrid Working Available A leading organisation is seeking a talented Business Systems and Data Analyst to join its growing team. This is a fantastic opportunity for an analytical, commercially minded individual to play a key role in strengthening business intelligence across a diverse and fast‑paced group environment. The Business Systems & Data Analyst will play a key role in ma…",40000.0,50000.0,2026-03-30T16:35:35Z,https://www.adzuna.co.uk/jobs/land/ad/5683226497?se=PJFk9CEz8RGFqquviAJvug&utm_medium=api&utm_source=5731d18b&v=AE0FB09829BF554404496CDEB12E4859EBF574A2,adzuna,2026-04-08,False,False,False,False,False,True,False,False,False,False,False,False,False,False,False,50000.0,40000.0,£35k–£50k,Mid-level
195,Senior BI Data Analyst,ADLIB,"Castle Cary, Somerset",Other UK,0,"On-site data expert shaping trusted insight across a luxury hospitality and ecommerce environment. Own end to end BI and reporting in a highly visible, stakeholder facing role. Work on site (daily) in a unique hospitality setting with real impact. Competitive salary with long term progression and international travel opportunities. This Senior BI Data Analyst role is all about ownership, visibility and impact. You will create and deliver trusted reporting that supports day to day decision makin…",50000.0,70000.0,2026-03-24T15:42:49Z,https://www.adzuna.co.uk/jobs/land/ad/5676937993?se=PJFk9CEz8RGFqquviAJvug&utm_medium=api&utm_source=5731d18b&v=427AD562A988D335DE7814BA07981E0D69947D07,adzuna,2026-04-08,False,False,False,False,False,True,False,False,False,False,False,False,False,False,False,,50000.0,£50k–£70k,Senior
196,Graduate Commercial Data Analyst,MSA Data Analytics Ltd,"Leicestershire, East Midlands",Other UK,0,"This post represents an exciting opportunity to contribute to the development of analytical strategy and modelling capability within highly commercial business function. The business is looking at exceptional level analytical graduates, who have excelled academically within Mathematical Sciences, Statistics, Operational Research or Economics (or equivalent). Any commercial experience through a placement year or post university in a data/analytical driven post will be highly advantageous. Respon…",27000.0,30000.0,2026-03-13T19:41:45Z,https://www.adzuna.co.uk/jobs/land/ad/5663924178?se=PJFk9CEz8RGFqquviAJvug&utm_medium=api&utm_source=5731d18b&v=AA411EAF7EC0AAE9F55EC83DC7EA5416A23A7740,adzuna,2026-04-08,False,False,False,True,False,True,False,False,False,False,False,False,False,False,False,,27000.0,£25k–£35k,Junior
197,Data Analyst,Redcentric,"Birmingham, West Midlands",Birmingham,0,"About the Role At RedCentric, data drives our decisions and fuels our growth. We are seeking a skilled Data Analyst to join our team and transform complex data into actionable insights that empower our business strategies. This role offers a unique opportunity to work with diverse datasets, collaborate across departments, and contribute to impactful projects that shape the future of our company. Key Objectives Analyze and interpret data to identify trends, patterns, and opportunities. Deliver c…",29800.0,29800.0,2026-04-04T17:46:27Z,https://www.adzuna.co.uk/jobs/details/5689935605?utm_medium=api&utm_source=5731d18b,adzuna,2026-04-08,False,False,False,False,False,True,False,False,False,False,False,False,False,False,False,,29800.0,£25k–£35k,Mid-level
198,Data Analyst / Stafford,Oliver James,"Stafford, Staffordshire",Other UK,0,"Data Analyst Stafford UK Based Salary £45,000 We're looking for an analytically minded Accounts & Regulatory Data Analyst to take ownership of our MI, regulatory reporting data, and financial systems automation. This is a standalone role with real influence, ideal for someone who enjoys working end-to-end, from data extraction through to insight, storytelling and process improvement. If you love data, Excel, and making messy datasets make sense, this role offers the freedom to shape how we use …",48442.17,48442.17,2026-03-20T17:14:12Z,https://www.adzuna.co.uk/jobs/land/ad/5673229755?se=PJFk9CEz8RGFqquviAJvug&utm_medium=api&utm_source=5731d18b&v=970C237D6C19BDFA913159286DB982D5B62CB9B3,adzuna,2026-04-08,False,False,False,True,False,True,False,False,False,False,False,False,False,False,False,45000.0,48442.17,£35k–£50k,Mid-level
199,Data Analyst (Remote),Marstep Resourcing Solutions,"Chester, Cheshire",Other UK,0,"This is a great opportunity to join a long established and growing business where you will have the opportunity to develop a worthwhile career and be rewarded with good benefits and profit share. Salary From £25k to £28.5k - depending upon experience plus profit share of around 15% per annum and an opportunity to develop a long career. You may have some or all of the skills/requirements below, but training can be provided in areas and you will have the chance to learn skills you are not current…",25000.0,28500.0,2026-03-13T19:41:37Z,https://www.adzuna.co.uk/jobs/land/ad/5663923729?se=PJFk9CEz8RGFqquviAJvug&utm_medium=api&utm_source=5731d18b&v=49899CD1E6AFA61BBA28B015B3E567994036EBD2,adzuna,2026-04-08,False,False,False,False,False,True,False,False,False,False,False,False,False,False,False,25000.0,25000.0,£25k–£35k,Mid-level
200,Technical Governance Data Analyst,Pilgrims Europe,"Craigavon, Northern Ireland",Other UK,0,"Technical Governance Data Analyst Location: Craigavon Join Pilgrim's as our next Technical Governance Data Analyst and play a key role in improving food safety, quality, and performance across our European and global operations. If you're passionate about turning data into actionable insight, and want a role where your analysis truly shapes decision-making, this is the opportunity for you. What You'll Do Lead the collection, accuracy, and reporting of all technical KPI data. Build clear, insigh…",41061.71,41061.71,2026-03-31T03:07:19Z,https://www.adzuna.co.uk/jobs/land/ad/5683762886?se=PJFk9CEz8RGFqquviAJvug&utm_medium=api&utm_source=5731d18b&v=7032D78551415E42D0BCCF9EF1804AD5F49471D6,adzuna,2026-04-08,False,False,False,False,False,True,False,False,False,False,False,False,False,False,False,,41061.71,£35k–£50k,Mid-level
