id,title,company,location,region,is_remote,description,min_amount,max_amount,date_posted,job_url,site,scraped_date,Python,SQL,Power BI,Excel,Tableau,R,Azure,AWS,Spark,Machine Learning,pandas,NumPy,Looker,dbt,Snowflake,parsed_salary,salary,salary_band,seniority
173,Finance Data Analyst,Lynx Recruitment Ltd,"London, UK",London,0,"Financial Data Analyst Lynx are currently working with a large IT consultancy to help them source a Finance Data Analyst . Our client is large global Consultancy who work with enterprise clients, solving their business and technology problems using cutting edge Solutions. Responsibilities: Manage cloud cost reporting, including spend tracking, forecasting, and optimisation analysis Produce regular and ad hoc financial reports using data tools and dashboards Analyse cost trends and provide insig…",40000.0,50000.0,2026-04-13T12:15:55Z,https://www.adzuna.co.uk/jobs/land/ad/5698072977?se=UnlYDXRE8RGlmrpGPMBDcg&utm_medium=api&utm_source=5731d18b&v=9CB153CEF59CBDA56B5725A36671F77EF0D7E850,adzuna,2026-04-30,False,False,False,False,False,True,False,False,False,False,False,False,False,False,False,,40000.0,£35k–£50k,Mid-level
174,BI & Data Analyst,Morgan Hunt Recruitment,"Tunbridge Wells, Kent",Other UK,0,"Morgan Hunt are working exclusively with Tonbridge school to hire a Business Intelligence & Data Analyst to shape how data drives decision-making across a complex, multi-stakeholder organisation. You'll take ownership of end-to-end analytics delivery-from scoping and data modelling through to building dashboards and presenting insights to senior leaders. This is a hands-on role where technical capability meets real business influence. Power BI sits at the heart of the analytics stack, and you'l…",50000.0,55000.0,2026-04-24T19:25:31Z,https://www.adzuna.co.uk/jobs/land/ad/5709492209?se=UnlYDXRE8RGlmrpGPMBDcg&utm_medium=api&utm_source=5731d18b&v=4E0E2BDF914E476B6BD910F32FAD76261FB102D5,adzuna,2026-04-30,False,False,True,False,False,True,False,False,False,False,False,False,False,False,False,,50000.0,£50k–£70k,Mid-level
175,Data Analyst,More in Common,"London, UK",London,0,"Data Analyst LOCATION: London (Monday-Thursday in the office, Friday remote) CONTRACT: Full-time SALARY: £37,000-£47,000 START DATE: Summer 2026 About More in Common More in Common is a research agency working across the US, UK, Germany, France and Poland to tackle polarisation and division. More in Common leads and supports initiatives to build more united, inclusive, and resilient societies. Our mission is to understand the forces driving us apart, help societies find common ground and bring …",37000.0,47000.0,2026-04-26T07:48:47Z,https://www.adzuna.co.uk/jobs/land/ad/5710922936?se=UnlYDXRE8RGlmrpGPMBDcg&utm_medium=api&utm_source=5731d18b&v=32B0A46241F0721310AD68BB6FBB3E5AF8546E9C,adzuna,2026-04-30,False,False,False,False,False,True,False,False,False,False,False,False,False,False,False,37000.0,37000.0,£35k–£50k,Mid-level
176,Junior Data Analyst,Anglian Home Improvements,"Norwich, Norfolk",Other UK,0,"Junior Data Analyst - Office based role - Norwich, Norfolk We are seeking a motivated and detail-oriented Junior Data Analyst to join our team. This is an excellent opportunity for someone looking to begin or grow their career in data analytics within a supportive and forward-thinking environment. About the Role As a Junior Data Analyst, you will play a key role in transforming raw data into meaningful insights that support strategic decision-making across the business. You’ll work closely with…",25000.0,30000.0,2026-04-29T15:49:09Z,https://www.adzuna.co.uk/jobs/land/ad/5713698480?se=UnlYDXRE8RGlmrpGPMBDcg&utm_medium=api&utm_source=5731d18b&v=FD1A5756C2DD0FC7FA3FA37070506DB1ED95B474,adzuna,2026-04-30,False,False,False,True,False,True,False,False,False,False,False,False,False,False,False,,25000.0,£25k–£35k,Junior
177,Lead Data Analyst,Harnham - Data & Analytics Recruitment,"London, UK",London,0,"Lead Data Analyst London, Hybrid (1-2x per week) Up to £65,000 This is an exciting opportunity to join a high-growth organisation where data science directly shapes performance marketing strategy. You will lead a growing data science function, drive long-term analytical programmes, and play a key role in delivering meaningful commercial impact for well-known consumer brands. The Company They are a specialist performance marketing and technology business known for combining deep analytical exper…",55000.0,65000.0,2026-04-28T11:38:31Z,https://www.adzuna.co.uk/jobs/land/ad/5712644576?se=UnlYDXRE8RGlmrpGPMBDcg&utm_medium=api&utm_source=5731d18b&v=20DAA6EA7049BB5F1D793DB13E7953E32960967B,adzuna,2026-04-30,False,False,False,False,False,True,False,False,False,False,False,False,False,False,False,65000.0,55000.0,£50k–£70k,Senior
178,ESG Data Analyst,Elevation Recruitment Group,"Rotherham, South Yorkshire",Other UK,0,"Job Title: ESG AnalystLocation: Rotherham (fully site based)Salary: £30,000 - £33,000 Elevation Tech & Transformation are looking for a detail-oriented Data Analyst to join one of our key clients in Rotherham. This is a great opportunity for someone interested in sustainability, data analysis and reporting. You’ll play a key role in collecting, validating and analysing ESG (Environmental, Social and Governance) data, supporting the organisation’s sustainability initiatives and regulatory report…",30000.0,33000.0,2026-04-27T15:35:48Z,https://www.adzuna.co.uk/jobs/land/ad/5711847052?se=UnlYDXRE8RGlmrpGPMBDcg&utm_medium=api&utm_source=5731d18b&v=9849881D73EC738D7E083C4C18901C91C0ACCBDA,adzuna,2026-04-30,False,False,False,False,False,True,False,False,False,False,False,False,False,False,False,30000.0,30000.0,£25k–£35k,Mid-level
179,Graduate Data Analyst,FLTalent,"Brighton, East Sussex",Other UK,0,"About the Company We are a leading technology consultancy helping organisations unlock the value of their data. Working across sectors such as finance, healthcare, and retail, we deliver insights, analytics solutions, and digital transformation projects for a wide range of clients. The Role As a Graduate Data Analyst, you will join our structured training programme designed to develop your technical and consulting skills from day one. You’ll work on real client projects while receiving hands-on…",30003.08,30003.08,2026-04-27T15:34:26Z,https://www.adzuna.co.uk/jobs/land/ad/5711843464?se=UnlYDXRE8RGlmrpGPMBDcg&utm_medium=api&utm_source=5731d18b&v=2B484375BFCA3DBCD7BFF587D8AC9BEA30E66612,adzuna,2026-04-30,False,False,False,False,False,True,False,False,False,False,False,False,False,False,False,,30003.08,£25k–£35k,Junior
180,Data Analyst Apprentice,QA,"Newcastle Upon Tyne, Tyne & Wear",Other UK,0,"Avanade UK Ltd is an IT consulting company that helps organisations improve their operations through technology. Specialising in Microsoft platforms, it provides services in cloud computing, data and AI, cybersecurity, and business applications, supporting clients with digital transformation and modern workplace solutions. Why join us? You will become part of an active and growing AI community Your future colleagues will help you with questions and challenges. Moreover, there is a pleasant, inf…",24707.0,24707.0,2026-04-28T11:36:54Z,https://www.adzuna.co.uk/jobs/land/ad/5712644371?se=UnlYDXRE8RGlmrpGPMBDcg&utm_medium=api&utm_source=5731d18b&v=41F553E2B612E4EBBB85C3475F1A99366E8B14BE,adzuna,2026-04-30,False,False,False,False,False,True,False,False,False,False,False,False,False,False,False,,24707.0,Under £25k,Mid-level
181,OpsRes Data Analyst,Xcede,"Yorkshire And The Humber, UK",Other UK,0,"OpsRes Data Analyst Were supporting a global enterprise undergoing a major transformation across technology operations and resilience We arelooking for a senior Data Analyst to drive resilience reporting, systemic risk analysis, and executive-level insight across critical technology platforms and services. This role focuses on building resilience KPIs, KRIs, dashboards, and reporting by bringing together data from incidents, observability platforms, change failures, and service management tools…",53446.3,53446.3,2026-04-29T23:20:54Z,https://www.adzuna.co.uk/jobs/land/ad/5713959972?se=UnlYDXRE8RGlmrpGPMBDcg&utm_medium=api&utm_source=5731d18b&v=108B9FC8C2546FBAD83E4D196E8203276A5849F9,adzuna,2026-04-30,False,False,False,False,False,True,False,False,False,False,False,False,False,False,False,,53446.3,£50k–£70k,Mid-level
182,Systems and Data Analyst,Acis Group,"Gainsborough, Lincolnshire",Other UK,0,"If you love making systems work brilliantly for the people who use them, this is your kind of role. As a Systems & Data Analyst, youll help our teams get the right information at the right time, support them in using our systems confidently, and champion improvements that make everyday tasks easier and smarter. Youll be hands-on with everything from system configuration to data reporting, all while helping us build a stronger, more connected digital foundation for the future. Here's what Manage…",40000.0,40000.0,2026-04-13T22:29:32Z,https://www.adzuna.co.uk/jobs/land/ad/5698419469?se=UnlYDXRE8RGlmrpGPMBDcg&utm_medium=api&utm_source=5731d18b&v=81FE50930908FB61BE61E13B7F21BF5C7E044488,adzuna,2026-04-30,False,False,False,False,False,True,False,False,False,False,False,False,False,False,False,,40000.0,£35k–£50k,Mid-level
183,Data Analyst,B&M Retail UK,"Liverpool, Merseyside",Other UK,0,"If you are passionate about turning data into insight and thrive in a fast-paced retail environment, this role offers the opportunity to make a real impact. Key Responsibilities Collect, cleanse, analyse, and visualise data from multiple sources to generate actionable insights that support business decisions and transformation objectives. Translate complex analysis into clear reports, dashboards, and recommendations for stakeholders, Ensure data accuracy, quality assurance, and adherence to cha…",30076.0,30076.0,2026-04-19T11:13:17Z,https://www.adzuna.co.uk/jobs/details/5704446459?utm_medium=api&utm_source=5731d18b,adzuna,2026-04-30,False,False,False,False,False,True,False,False,False,False,False,False,False,False,False,,30076.0,£25k–£35k,Mid-level
184,Pricing Data Analyst,Agility,"Blackpool, Lancashire",Other UK,0,"Pricing & Commercial Analyst | Data Analyst | Entry Level Analyst – Blackpool Location: Blackpool (Office-Based, Full-Time / Part Time) Salary: £30,000  Benefits Are you early in your career and looking to develop your skills as a Pricing & Commercial Analyst ? This is a great opportunity for a Pricing & Commercial Analyst to join a growing business where you can build experience in data, pricing, and commercial analysis. This Pricing & Commercial Analyst role is ideal if you enjoy working with…",28000.0,30000.0,2026-04-29T19:48:15Z,https://www.adzuna.co.uk/jobs/land/ad/5713819549?se=UnlYDXRE8RGlmrpGPMBDcg&utm_medium=api&utm_source=5731d18b&v=0D5C915726CA8DDA31DC29E3C1D23763466C1037,adzuna,2026-04-30,False,False,False,False,False,True,False,False,False,False,False,False,False,False,False,30000.0,28000.0,£25k–£35k,Mid-level
185,Senior Data Analyst,Signature Recruitment,"London, UK",London,0,"Do you enjoy uncovering the story behind complex data? Are you confident using tools like Power BI and Tableau to deliver clear, meaningful insight? Ready to shape decisions by presenting data in a way that truly lands? Signature Recruitment are working with a well-regarded London organisation to recruit a Senior Data Analyst, offering a hybrid working pattern and immediate start. This 6-month temporary Senior Data Analyst role is based in London, with three days onsite and two working from hom…",62400.0,68640.0,2026-04-28T11:41:20Z,https://www.adzuna.co.uk/jobs/land/ad/5712644916?se=UnlYDXRE8RGlmrpGPMBDcg&utm_medium=api&utm_source=5731d18b&v=C900725BC6E436DEEFCCDEFC66A05D87310BCFAA,adzuna,2026-04-30,False,False,True,False,True,True,False,False,False,False,False,False,False,False,False,,62400.0,£50k–£70k,Senior
186,Senior Data Analyst,Michael Page Technology,"Brighton, East Sussex",Other UK,0,"We're hiring an experienced Data & Insights Analyst to help shape evidence-driven decision-making within a major national regulatory environment. In this role, you'll transform complex data into clear, actionable insights that directly inform strategy, policy development, and operational priorities. Client Details This role is within a well-established public sector organisation. The company is recognised for its structured approach and commitment to delivering high-quality services. Descriptio…",130000.0,130000.0,2026-04-23T23:14:21Z,https://www.adzuna.co.uk/jobs/land/ad/5708776167?se=UnlYDXRE8RGlmrpGPMBDcg&utm_medium=api&utm_source=5731d18b&v=DEFF90919EA42927BD8DB55FA0717812BA251C4C,adzuna,2026-04-30,False,False,False,False,False,True,False,False,False,False,False,False,False,False,False,,130000.0,£70k+,Senior
187,CRM Marketing Data Analyst,Uniting Ambition,"Redditch, Worcestershire",Other UK,0,"CRM Marketing Data Analyst Contract Outside IR35 Redditch (2 days per week on-site) 6-months £400.00 - £450.00 per day To start Tuesday 5th May Overview The CRM Marketing Data Analyst is responsible for the scoping and hands on delivery of CRM / Email Campaign analysis and is a pivotal role in the growth of a CRM programme contributing to 20% of Group Turnover. The role is not just delivering numbers, but a proactive role accountable for stakeholder management and the ability to drive action fr…",104000.0,117000.0,2026-04-22T19:12:17Z,https://www.adzuna.co.uk/jobs/land/ad/5707345194?se=UnlYDXRE8RGlmrpGPMBDcg&utm_medium=api&utm_source=5731d18b&v=B1794CEA74D0CD02250BC82A5C801975F46D738A,adzuna,2026-04-30,False,False,False,False,False,True,False,False,False,False,False,False,False,False,False,400.0,104000.0,£70k+,Mid-level
188,Data Analyst Performance Science,Brighton & Hove Albion Football Club,"Lancing, West Sussex",Other UK,0,"Role: Data Analyst - Performance Science Hours: Full time Location: American Express Elite Football Performance Centre, Lancing, BN15 9FP Contract Type: Permanent Deadline Day: 4 May 2026 About Brighton & Hove Albion FC We compete at the highest levels of football on a global stage while embracing our Sussex community spirit. At the heart of everything we do is our commitment to high performance, professional excellence, and making a positive impact. Shape the future of football performance Thi…",39476.54,39476.54,2026-04-21T12:57:04Z,https://www.adzuna.co.uk/jobs/land/ad/5706142829?se=UnlYDXRE8RGlmrpGPMBDcg&utm_medium=api&utm_source=5731d18b&v=D119B2602DFDA7A574BBEDDDE9387A1FE2D60D20,adzuna,2026-04-30,False,False,False,True,False,True,False,False,False,False,False,False,False,False,False,,39476.54,£35k–£50k,Mid-level
189,Data Analyst - Operational Resilience,ECS,"Sheffield, South Yorkshire",Other UK,0,"Data Analyst 2-3 days p/week in Sheffield 6-month rolling contract Inside IR35 We're seeking a Data Analyst to measure and report operational resilience maturity and systemic risk across a large enterprise environment. Key Responsibilities: Design and maintain resilience KPIs and KRIs aligned to key outcomes Integrate and analyse data from incident, change, observability, and service management platforms Identify trends, risks, and improvement opportunities across the estate Produce executive d…",130000.0,156000.0,2026-04-30T03:39:13Z,https://www.adzuna.co.uk/jobs/land/ad/5714138126?se=UnlYDXRE8RGlmrpGPMBDcg&utm_medium=api&utm_source=5731d18b&v=4DC396168F9C9B143AE07321AF12974FED4DF566,adzuna,2026-04-30,False,False,False,False,False,True,False,False,False,False,False,False,False,False,False,,130000.0,£70k+,Mid-level
190,Data Analyst - Corporate Property,Hays Specialist Recruitment Limited,"Birmingham, West Midlands",Birmingham,0,"Contract: 6 months Location: Hybrid - 1 day per week on site Hays are working in partnership with a local council to recruit a Data Analyst to support the Corporate Property Team. This is a newly created role, offering an exciting opportunity to play a key part in shaping the council's Corporate Asset Management Strategy. The RoleAs a Data Analyst, you will be responsible for improving the quality, accuracy, and usability of corporate property data. Your work will enable evidence-based decision…",93600.0,93600.0,2026-04-29T19:48:41Z,https://www.adzuna.co.uk/jobs/land/ad/5713819626?se=UnlYDXRE8RGlmrpGPMBDcg&utm_medium=api&utm_source=5731d18b&v=D85D8D6A3A1C660B10C1F82882F35DBB034A6255,adzuna,2026-04-30,False,False,False,False,False,True,False,False,False,False,False,False,False,False,False,,93600.0,£70k+,Mid-level
191,Business Data Analyst,HAYS,"Glasgow, Scotland",Scotland,0,"Business Data Analyst (Fixed-Term Contract) Location: Hybrid / UK-based (with site or office attendance as required) Contract: Fixed-Term Contract (initially 3-6 months, with potential extension) Salary: 35,000 - 42,000 (pro rata) Clearance: SC Cleared (Ideally existing SC) The Opportunity An established organisation operating within a highly regulated, safety‑critical environment is entering an important phase of data and reporting maturity and is seeking a Business Data Analyst on a fixed-ter…",35000.0,42000.0,2026-04-24T20:43:44Z,https://www.adzuna.co.uk/jobs/land/ad/5709513251?se=UnlYDXRE8RGlmrpGPMBDcg&utm_medium=api&utm_source=5731d18b&v=86DA8F9081C40234965CEE63F3346E2DDADBD37C,adzuna,2026-04-30,False,False,False,False,False,True,False,False,False,False,False,False,False,False,False,,35000.0,£35k–£50k,Mid-level
192,Data Analyst,Rev & Regs,"London, UK",London,0," Data Analyst – Fintech (Payments) We’re working with a fast-growing fintech in the payments space looking to hire a Data Analyst into their central data team. This is a high-impact role at an exciting stage of growth, with strong exposure across Finance, Treasury, and Operations.  Role responsibilities: Partner with Finance, Treasury, and Operations to deliver key business insights Analyse performance metrics (e.g. SLAs, processing times) to identify improvements Support revenue analysis, fore…",82564.16,82564.16,2026-04-25T16:09:29Z,https://www.adzuna.co.uk/jobs/land/ad/5710393157?se=UnlYDXRE8RGlmrpGPMBDcg&utm_medium=api&utm_source=5731d18b&v=2181D8B3C8B9ABBA161A713DB1E103736F893788,adzuna,2026-04-30,False,False,False,False,False,True,False,False,False,False,False,False,False,False,False,,82564.16,£70k+,Mid-level
193,Data Analyst Bootcamp (Liverpool),ITonlinelearning Recruitment,"Low Hill, Liverpool",Other UK,0,"Data Analyst Course Programme – Job Guarantee Included Complete online training designed to take you from zero experience to your first data analyst role. Study part-time, build fundamental skills, and get dedicated job placement support until you're hired. Flexible financing options available, with payment plans starting from as low as £142 per month. The Programme Complete this 10-week online training with just 10-15 hours per week of study time. You'll learn industry-standard tools, includin…",39756.5,39756.5,2026-04-17T12:13:53Z,https://www.adzuna.co.uk/jobs/land/ad/5702474523?se=UnlYDXRE8RGlmrpGPMBDcg&utm_medium=api&utm_source=5731d18b&v=D0F22700419F4C63AAC4DE2792AF0025AE776AD5,adzuna,2026-04-30,False,False,False,False,False,True,False,False,False,False,False,False,False,False,False,142000.0,39756.5,£35k–£50k,Mid-level
194,Data Analyst Bootcamp (Wolverhampton),ITonlinelearning Recruitment,"Blakenhall, Wolverhampton",Other UK,0,"Data Analyst Course Programme – Job Guarantee Included Complete online training designed to take you from zero experience to your first data analyst role. Study part-time, build fundamental skills, and get dedicated job placement support until you're hired. Flexible financing options available, with payment plans starting from as low as £142 per month. The Programme Complete this 10-week online training with just 10-15 hours per week of study time. You'll learn industry-standard tools, includin…",39260.81,39260.81,2026-04-17T12:13:55Z,https://www.adzuna.co.uk/jobs/land/ad/5702474816?se=UnlYDXRE8RGlmrpGPMBDcg&utm_medium=api&utm_source=5731d18b&v=D6FBE5E0CAC7FBBC29C9A0336B63B79AA3D6FA63,adzuna,2026-04-30,False,False,False,False,False,True,False,False,False,False,False,False,False,False,False,142000.0,39260.81,£35k–£50k,Mid-level
195,Data Analyst Bootcamp (Burnley),ITonlinelearning Recruitment,"Reedley, Burnley",Other UK,0,"Data Analyst Course Programme – Job Guarantee Included Complete online training designed to take you from zero experience to your first data analyst role. Study part-time, build fundamental skills, and get dedicated job placement support until you're hired. Flexible financing options available, with payment plans starting from as low as £142 per month. The Programme Complete this 10-week online training with just 10-15 hours per week of study time. You'll learn industry-standard tools, includin…",38686.05,38686.05,2026-04-17T12:14:00Z,https://www.adzuna.co.uk/jobs/land/ad/5702475667?se=UnlYDXRE8RGlmrpGPMBDcg&utm_medium=api&utm_source=5731d18b&v=B4F8175D975A4F1BB6E167BEF2268006D01A5FA9,adzuna,2026-04-30,False,False,False,False,False,True,False,False,False,False,False,False,False,False,False,142000.0,38686.05,£35k–£50k,Mid-level
196,Certified Data Analyst Trainee (Aberdeen),ITonlinelearning Recruitment,"Torry, Aberdeen",Other UK,0,"Data Analyst Course Programme – Job Guarantee Included Complete online training designed to take you from zero experience to your first data analyst role. Study part-time, build fundamental skills, and get dedicated job placement support until you're hired. Flexible financing options available, with payment plans starting from as low as £142 per month. The Programme Complete this 10-week online training with just 10-15 hours per week of study time. You'll learn industry-standard tools, includin…",31146.84,31146.84,2026-04-17T12:14:07Z,https://www.adzuna.co.uk/jobs/land/ad/5702476624?se=UnlYDXRE8RGlmrpGPMBDcg&utm_medium=api&utm_source=5731d18b&v=9093AA3A578D8C2E09D0213E51922AA6A2BCBE4C,adzuna,2026-04-30,False,False,False,False,False,True,False,False,False,False,False,False,False,False,False,142000.0,31146.84,£25k–£35k,Junior
197,Data Analyst Career Launch (Lewisham),ITonlinelearning Recruitment,"Catford, South East London",London,0,"Data Analyst Course Programme – Job Guarantee Included Complete online training designed to take you from zero experience to your first data analyst role. Study part-time, build fundamental skills, and get dedicated job placement support until you're hired. Flexible financing options available, with payment plans starting from as low as £142 per month. The Programme Complete this 10-week online training with just 10-15 hours per week of study time. You'll learn industry-standard tools, includin…",34080.11,34080.11,2026-04-17T12:14:07Z,https://www.adzuna.co.uk/jobs/land/ad/5702476665?se=UnlYDXRE8RGlmrpGPMBDcg&utm_medium=api&utm_source=5731d18b&v=442B4A93C039598662125127702CC44B49437271,adzuna,2026-04-30,False,False,False,False,False,True,False,False,False,False,False,False,False,False,False,142000.0,34080.11,£25k–£35k,Mid-level
198,Data Analyst Employment Accelerator (Brent),ITonlinelearning Recruitment,"Barn Hill, North West London",London,0,"Data Analyst Course Programme – Job Guarantee Included Complete online training designed to take you from zero experience to your first data analyst role. Study part-time, build fundamental skills, and get dedicated job placement support until you're hired. Flexible financing options available, with payment plans starting from as low as £142 per month. The Programme Complete this 10-week online training with just 10-15 hours per week of study time. You'll learn industry-standard tools, includin…",35003.64,35003.64,2026-04-17T12:13:54Z,https://www.adzuna.co.uk/jobs/land/ad/5702474688?se=UnlYDXRE8RGlmrpGPMBDcg&utm_medium=api&utm_source=5731d18b&v=09FC41BC43518B3B65F965108A24D81C442E0A0D,adzuna,2026-04-30,False,False,False,False,False,True,False,False,False,False,False,False,False,False,False,142000.0,35003.64,£35k–£50k,Mid-level
199,Data Analyst Career Bootcamp (Wandsworth),ITonlinelearning Recruitment,"Wandsworth, South West London",London,0,"Data Analyst Course Programme – Job Guarantee Included Complete online training designed to take you from zero experience to your first data analyst role. Study part-time, build fundamental skills, and get dedicated job placement support until you're hired. Flexible financing options available, with payment plans starting from as low as £142 per month. The Programme Complete this 10-week online training with just 10-15 hours per week of study time. You'll learn industry-standard tools, includin…",43861.46,43861.46,2026-04-17T12:13:54Z,https://www.adzuna.co.uk/jobs/land/ad/5702474563?se=UnlYDXRE8RGlmrpGPMBDcg&utm_medium=api&utm_source=5731d18b&v=E2CBDB57DFFC4353D3CE942E9BB742492FEFF929,adzuna,2026-04-30,False,False,False,False,False,True,False,False,False,False,False,False,False,False,False,142000.0,43861.46,£35k–£50k,Mid-level
