id,title,company,location,region,is_remote,description,min_amount,max_amount,date_posted,job_url,site,scraped_date,Python,SQL,Power BI,Excel,Tableau,R,Azure,AWS,Spark,Machine Learning,pandas,NumPy,Looker,dbt,Snowflake,parsed_salary,salary,salary_band,seniority
58,Data Analyst,Hays Specialist Recruitment Limited,"Gainsborough, Lincolnshire",Other UK,0,"Data Analyst - Own the Insight in a Complex ERP Transformation Gainsborough (3-4 days on site) £40-45,000 If you're the kind of Data Analyst who likes stepping into something new, figuring things out quickly, and becoming the person everyone turns to for clarity, this is the kind of role that will energise you from day one.You'll be joining at one of the most interesting moments in a business's life: a major ERP transformation heading towards go live. The data landscape is big, complex and full…",40000.0,45000.0,2026-03-26T22:12:41Z,https://www.adzuna.co.uk/jobs/land/ad/5679738950?se=hJMp4dQp8RGtR4i3pnY7PQ&utm_medium=api&utm_source=5731d18b&v=3C6A9ADBAC27004069F87693C8054A1EE3EA8329,adzuna,2026-03-27,False,False,False,False,False,True,False,False,False,False,False,False,False,False,False,40000.0,40000.0,£35k–£50k,Mid-level
59,Data Analyst,Ardour Associates Ltd,"Hampton Poyle, Kidlington",Other UK,0,"Job Title: Logging Data Analyst Location: Thames Valley Region Salary: £28,000 per annum Job Type: Full-Time Overview: An exciting opportunity has arisen for a Logging Data Analyst to join a market-leading utilities contractor specialising in water leakage detection and clean water network management. As a key member of the data team, you’ll play an essential role in identifying high-leakage areas, producing field information for technicians, and supporting the wider operations with data-driven…",28000.0,28000.0,2026-03-09T16:24:56Z,https://www.adzuna.co.uk/jobs/land/ad/5659469687?se=hJMp4dQp8RGtR4i3pnY7PQ&utm_medium=api&utm_source=5731d18b&v=DC19C59EFC323035A8B626EFAF3D91B5A8F192F1,adzuna,2026-03-27,False,False,False,False,False,True,False,False,False,False,False,False,False,False,False,28000.0,28000.0,£25k–£35k,Mid-level
60,Data Analyst,Eclectic Recruitment,"Thorney, Peterborough",Other UK,0,"We’re delighted to be partnering with a fantastic business, based in Peterborough, in their search for a new Data Analyst. This is a full time position offering hybrid working. Main duties will include: * Collecting and analysing data sets to provide insights * Identifying trends and patterns within the data * Building data visualisations, dashboards and reports * Automating data reporting to reduce manual workload * Working with a host of stakeholders across the business * Supporting training …",28000.0,38000.0,2026-01-07T15:54:44Z,https://www.adzuna.co.uk/jobs/land/ad/5571499875?se=hJMp4dQp8RGtR4i3pnY7PQ&utm_medium=api&utm_source=5731d18b&v=8D28AE79B8850B749114E0010D0979C40AC0D0D5,adzuna,2026-03-27,False,False,False,False,False,True,False,False,False,False,False,False,False,False,False,,28000.0,£25k–£35k,Mid-level
61,Data Analyst,Experis,"The City, Central London",London,0,"Data Analyst Onsite Requirements: Remote Start Date: ASAP Role Duration: 1 year Clerance Requirements: Active SC clearance Inside IR35 - umbrella only Role Description: We're looking for a Data Engineer whose main focus is understanding and documenting existing systems, with the goal of supporting decommissioning activities. The role centres on analysing current solutions built using Java, Node JS, and React, and developing a clear, end to end picture of how data flows across the wider programm…",130000.0,132600.0,2026-03-18T13:55:08Z,https://www.adzuna.co.uk/jobs/land/ad/5670704770?se=hJMp4dQp8RGtR4i3pnY7PQ&utm_medium=api&utm_source=5731d18b&v=A9E7CB9AD8DA8AC01E8305B37B0E17D47C840B0B,adzuna,2026-03-27,False,False,False,False,False,True,False,False,False,False,False,False,False,False,False,,130000.0,£70k+,Mid-level
62,Data Analyst,FERROVIAL CONSTRUCTION  LIMITED,"Farringdon, Central London",London,0,"Data Analyst The Data Analyst plays a key role on a large-scale infrastructure project, focusing on the development and ongoing maintenance of the project’s connected digital environment. The role involves analysing data to support decision-making and ensure project objectives are met. You will work closely with information management and project controls teams, using data to improve project efficiency and support digital transformation initiatives. You will join the FBRS (Ferrovial BAM Joint V…",45157.46,45157.46,2025-12-23T22:42:25Z,https://www.adzuna.co.uk/jobs/land/ad/5553640587?se=hJMp4dQp8RGtR4i3pnY7PQ&utm_medium=api&utm_source=5731d18b&v=8A7840CE89EE4324FFDD7F72544BAEA0B6936C0C,adzuna,2026-03-27,False,False,False,False,False,True,False,False,False,False,False,False,False,False,False,,45157.46,£35k–£50k,Mid-level
63,Data Analyst,Prestige Recruitment Specialists,"Brough, East Riding Of Yorkshire",Other UK,0,"Job Title: Data Analyst Reporting to: Business Solutions Manager Division / Department / Team: Group IT Salary: £35-£40,000k Location: Brough Job Purpose The purpose of this role is to work within the Business Solutions team to prepare, clean, and analyse data. The role involves regular communication with colleagues at all levels across the organisation. The successful candidate will be expected to understand underlying SQL databases, identify and deliver methods for gathering data from multipl…",35000.0,40000.0,2026-03-26T16:13:55Z,https://www.adzuna.co.uk/jobs/land/ad/5679326913?se=hJMp4dQp8RGtR4i3pnY7PQ&utm_medium=api&utm_source=5731d18b&v=ED5724AF795D0B2B85B11B9340F93BEC39474612,adzuna,2026-03-27,False,True,False,False,False,True,False,False,False,False,False,False,False,False,False,35000.0,35000.0,£35k–£50k,Mid-level
64,Data Analyst,Elite Hiring Solution,"Humberstone, Leicester",Other UK,0,"Our client, a leading organisation in the data and insights sector, is offering an exciting opportunity for graduates eager to begin their career in data analytics. As a Data Analyst, you’ll contribute to a range of projects involving data collection, processing, and analysis across multiple business areas, helping transform raw data into meaningful insights. This role offers hands-on experience with real-world datasets, enabling you to build your technical and analytical skills while supportin…",25000.0,30000.0,2026-03-06T17:03:25Z,https://www.adzuna.co.uk/jobs/land/ad/5656415660?se=hJMp4dQp8RGtR4i3pnY7PQ&utm_medium=api&utm_source=5731d18b&v=7CDB08A3743865DC15C180A9B42FA84F1307BFF0,adzuna,2026-03-27,False,False,False,False,False,True,False,False,False,False,False,False,False,False,False,,25000.0,£25k–£35k,Mid-level
65,Data Analyst,Post Recruitment Ltd,"Wakefield, West Yorkshire",Other UK,0,"Are you a detail-driven Data Analyst with strong Power BI expertise and a passion for improving how businesses use data? We are recruiting for a Data Analyst to join a growing organisation in a hybrid role based in Wakefield, offering a salary of up to £34,000. This Data Analyst opportunity is ideal for someone who enjoys building reporting frameworks, enhancing data visibility, and supporting strategic decision-making. The Role As a Data Analyst , you will take ownership of reporting processes…",30000.0,32000.0,2026-03-24T18:00:37Z,https://www.adzuna.co.uk/jobs/details/5677147295?utm_medium=api&utm_source=5731d18b,adzuna,2026-03-27,False,False,True,False,False,True,False,False,False,False,False,False,False,False,False,34000.0,30000.0,£25k–£35k,Mid-level
66,Data Analyst,POST recruitment,"Kirkhamgate, Wakefield",Other UK,0,"Are you a detail driven Data Analyst with strong Power BI expertise and a passion for improving how businesses use data? We are recruiting for a Data Analyst to join a growing organisation in a hybrid role based in Wakefield, offering a salary of up to £34,000. This Data Analyst opportunity is ideal for someone who enjoys building reporting frameworks, enhancing data visibility, and supporting strategic decision-making. The Role As a Data Analyst, you will take ownership of reporting processes …",30000.0,32000.0,2026-03-23T21:46:12Z,https://www.adzuna.co.uk/jobs/land/ad/5676324763?se=hJMp4dQp8RGtR4i3pnY7PQ&utm_medium=api&utm_source=5731d18b&v=76B54A402CE0D3C2D2D0B45BC581A3FD32291B9E,adzuna,2026-03-27,False,False,True,False,False,True,False,False,False,False,False,False,False,False,False,34000.0,30000.0,£25k–£35k,Mid-level
67,Data Analyst,JOB SWITCH LTD,"Bexleyheath, Kent",Other UK,0,"Purpose of the job Data Analyst To provide the Councils Management Board with accurate, relevant and timely data, research and performance information that contributes to a culture of continuous improvement, enhanced efficiency and evidence-based decision-making in the Council. This role is to support Childrens Services, in particular Education. Any experience of supporting the School Census return, CME/EHE return and Key Stage Collections would be useful. Also, prior experience of using Educat…",35360.0,35360.0,2026-03-25T14:43:42Z,https://www.adzuna.co.uk/jobs/details/5678124142?utm_medium=api&utm_source=5731d18b,adzuna,2026-03-27,False,False,False,False,False,True,False,False,False,False,False,False,False,False,False,,35360.0,£35k–£50k,Mid-level
68,Data Analyst,Travail Employment Group,"Dunham-On-Trent, Newark",Other UK,0,"Data Analyst Newark Full Time Permanent C£27K - £32K DOE Our client, a leader player in their sector is seeking a Data Analyst to join their business team. Working from a modern open plan office in Newark they are looking for a confident Data Analyst that wants to be rewarded for hard work and commitment. * Find and process data and gather sector insights – creating visual reports. * Analyse client performance and create reports on core KPIs or new product reports. * Produce reports and analysi…",27000.0,32000.0,2026-03-23T19:37:02Z,https://www.adzuna.co.uk/jobs/land/ad/5676148969?se=hJMp4dQp8RGtR4i3pnY7PQ&utm_medium=api&utm_source=5731d18b&v=4D09C2C0C6346CCABB3829EB87F3DC53C6ECA3FD,adzuna,2026-03-27,False,False,False,False,False,True,False,False,False,False,False,False,False,False,False,27000.0,27000.0,£25k–£35k,Mid-level
69,Data Analyst,Technical Prospects,"Bradford, West Yorkshire",Other UK,0,"Data Analyst Offering £40,000 - £45,000 basic salary Location: Bradford (Hybrid – 3 Days Office Based) Our client is an established B2B IT company based in West Yorkshire. Due to continued growth, they are currently recruiting a Data Analyst to own and deliver daily, weekly, and monthly commercial performance reporting for senior management and sales teams. The successful candidate will be commercially minded, confident engaging with the business, be focused on turning data into actionable insi…",40000.0,45000.0,2026-03-26T22:08:39Z,https://www.adzuna.co.uk/jobs/details/5679735872?utm_medium=api&utm_source=5731d18b,adzuna,2026-03-27,False,False,False,False,False,True,False,False,False,False,False,False,False,False,False,40000.0,40000.0,£35k–£50k,Mid-level
70,Data Analyst,Technical Prospects Ltd,"West Yorkshire, Yorkshire And The Humber",Other UK,0,"Data Analyst Offering £40,000 - £45,000 basic salary Location: Bradford (Hybrid – 3 Days Office Based) Our client is an established B2B IT company based in West Yorkshire. Due to continued growth, they are currently recruiting a Data Analyst to own and deliver daily, weekly, and monthly commercial performance reporting for senior management and sales teams. The successful candidate will be commercially minded, confident engaging with the business, be focused on turning data into actionable insi…",40000.0,45000.0,2026-03-26T16:28:01Z,https://www.adzuna.co.uk/jobs/details/5679333483?utm_medium=api&utm_source=5731d18b,adzuna,2026-03-27,False,False,False,False,False,True,False,False,False,False,False,False,False,False,False,40000.0,40000.0,£35k–£50k,Mid-level
71,Data Analyst,Absolute Recruit,"Luton, Bedfordshire",Other UK,0,"Data Analyst Luton (Fully Office-Based)£45,000 – £50,000 We’re working with a fast-growing, innovative business based in Luton that is investing heavily in its data capabilities. As part of their continued expansion, they are looking to appoint a Data Analyst to play a key role in transforming how the business uses data to drive decisions. This is a fantastic opportunity to join a forward-thinking organisation at an exciting stage of growth, where you’ll have the chance to introduce new tools, …",45000.0,50000.0,2026-03-24T17:57:16Z,https://www.adzuna.co.uk/jobs/details/5677146226?utm_medium=api&utm_source=5731d18b,adzuna,2026-03-27,False,False,False,False,False,True,False,False,False,False,False,False,False,False,False,45000.0,45000.0,£35k–£50k,Mid-level
72,Data Analyst,Method-Resourcing,"London, UK",London,0,Data Analyst l Oracle l Onprem l excel l PowerBI l Reporting l Banking l Financial services l Stakeholder management l £375 PD l Outside IR35 l 3 months l London I'm currently on the lookout for a data analyst to help one of my banking clients to extract data from their on-prem Oracle DB into PowerBI (along with other areas such as excel spreadsheets) Key Experience: Expert in dashboarding and knowledge around Business intelligence tools specifically with PowerBI Strong background in extracting…,0.0,97500.0,2026-02-23T14:29:47Z,https://www.adzuna.co.uk/jobs/details/5642462516?utm_medium=api&utm_source=5731d18b,adzuna,2026-03-27,False,False,False,True,False,True,False,False,False,False,False,False,False,False,False,375.0,0.0,Under £25k,Mid-level
73,Data Analyst,Vehicle Data Global Ltd.,"Chesterfield, Derbyshire",Other UK,0,"Data Analyst | Chesterfield | Starting at £26,000 Are you passionate about data and fascinated by cars and road vehicles? Ready to take the next step in your analytics career? Were looking for a detail-driven Data Analyst to join our growing team at Vehicle Data Global Ltd in Chesterfield! Why Join Us? At Vehicle Data Global , we power the UKs vehicle data industry. From cutting-edge VRM Lookup services to full vehicle history checks through our VDI Check platform, we deliver fast, reliable, an…",35000.0,35000.0,2026-03-17T22:39:39Z,https://www.adzuna.co.uk/jobs/details/5670092156?utm_medium=api&utm_source=5731d18b,adzuna,2026-03-27,False,False,False,False,False,True,False,False,False,False,False,False,False,False,False,26000.0,35000.0,£35k–£50k,Mid-level
74,Data Analyst,Venture Recruitment Partners,"Guildford, Surrey",Other UK,0,"Venture Recruitment Partners have been asked to help a fast paced business recruit a Data analyst for a short term contract. This role will work closely with the operational finance team to help them through their year end audit. Based in Guildford, this role is 5 days a week in the office. 6 - 8 weeks with a chance to extend. Data Analyst Key Responsibilities: - Sort large volumes of data from various systems- Upload valid data to external systems- Collaborate with the wider finance team Data …",37440.0,49920.0,2026-03-17T01:39:31Z,https://www.adzuna.co.uk/jobs/details/5669072549?utm_medium=api&utm_source=5731d18b,adzuna,2026-03-27,False,False,False,False,False,True,False,False,False,False,False,False,False,False,False,,37440.0,£35k–£50k,Mid-level
75,Data Analyst,Contechs Consulting,"Guys Cliffe, Warwick",Other UK,0,"Data Analyst 11-month contract Based in West Midlands £29.86 per hour (Inside IR35) *Applicants MUST have proof of immediate, on-going and valid eligibility, to work full time, and travel within, the UK* About the company I am currently recruiting on behalf of an automotive OEM, based in West Midlands, who are looking for a Data Analyst to join their team. Job Description As Data Analyst, your main responsibilities will include: Identify opportunities, improvements and gaps, in current reportin…",60028.0,62108.0,2026-03-23T17:41:16Z,https://www.adzuna.co.uk/jobs/details/5676126351?utm_medium=api&utm_source=5731d18b,adzuna,2026-03-27,False,False,False,False,False,True,False,False,False,False,False,False,False,False,False,29000.0,60028.0,£50k–£70k,Mid-level
76,Data Analyst,Ernest Gordon Recruitment,"Wadebridge, Cornwall",Other UK,0,"Data Analyst £25,000 - £35,000  Progression  Company benefits Wadebridge Are you a Data Analyst with a background working in solar, electrical, construction or similar looking for a brand-new position within an expanding team focused on pushing for a sustainable future, providing you with the opportunity to progress and grow with the business, whilst having access to fantastic company benefits? On offer is the opportunity to join a company at the forefront of the renewable energy sector offerin…",35000.0,35000.0,2026-03-09T14:35:53Z,https://www.adzuna.co.uk/jobs/details/5659436266?utm_medium=api&utm_source=5731d18b,adzuna,2026-03-27,False,False,False,False,False,True,False,False,False,False,False,False,False,False,False,25000.0,35000.0,£35k–£50k,Mid-level
77,Data Analyst,Corecom Consulting,"Ossett, West Yorkshire",Other UK,0,"Data Analyst / Leeds (Hybrid) / £30,000 - £35,000  bonus Are you a Data Analyst who enjoys turning messy data into meaningful insight? Do you want the opportunity to modernise a company's entire data platform and help drive a business towards becoming truly data-driven? We're working with a growing organisation in Leeds that is investing in its data capability as part of a major modernisation programme. This role has been created to support the migration away from a legacy data platform and hel…",30000.0,35000.0,2026-03-05T19:47:31Z,https://www.adzuna.co.uk/jobs/land/ad/5655171601?se=hJMp4dQp8RGtR4i3pnY7PQ&utm_medium=api&utm_source=5731d18b&v=7866972936F000B3CC04A336FBD478D00D35C511,adzuna,2026-03-27,False,False,False,False,False,True,False,False,False,False,False,False,False,False,False,30000.0,30000.0,£25k–£35k,Mid-level
78,Data Analyst,Symmetric Recruitment Ltd,"Pillaton, Saltash",Other UK,0,"Data Analyst Location: Plymouth Salary: £35,000 – £40,000 per annum Overview A leading maritime business in Plymouth is seeking a Data Analyst to support project and operational teams by analysing, tracking, and reporting key business data. Working closely with the Commercial Lead, Finance team, and project stakeholders, this role will focus on maintaining high-quality data, developing meaningful reports, and generating insights that support informed decision-making across major projects. This …",35000.0,40000.0,2026-03-16T19:59:53Z,https://www.adzuna.co.uk/jobs/details/5668795636?utm_medium=api&utm_source=5731d18b,adzuna,2026-03-27,False,False,False,False,False,True,False,False,False,False,False,False,False,False,False,35000.0,35000.0,£35k–£50k,Mid-level
79,Data Analyst,Ashdown Group,"Dartford, Kent",Other UK,0,"A well-established business is looking for a Data Analyst to join its team, based in Dartford, Kent. Please note that this role requires the chosen candidate to be based in the office 5 days per week. You will assist in the development of systems to improve efficiency and to continually improve the quality of data collection and dissemination. You will liaise with key stakeholders to capture requirements and then use technology to analyse and present data in readily accessible formats. In order…",35000.0,35000.0,2026-02-27T22:27:45Z,https://www.adzuna.co.uk/jobs/details/5647770939?utm_medium=api&utm_source=5731d18b,adzuna,2026-03-27,False,False,False,False,False,True,False,False,False,False,False,False,False,False,False,,35000.0,£35k–£50k,Mid-level
80,Data Analyst,Jackson Hogg Ltd,"Ingleton, Darlington",Other UK,0,"emp Data Analyst – Healthcare Competitor Analysis Fully Remote | Immediate Start | 8 weeks Must have Healthcare sector experience  We need a handson data analyst to deliver a focused healthcare competitor analysis project. This is a short-term, fully remote role for someone who can quickly research, analyse and turn findings into clear insight and recommendations. What you’ll do * Research healthcare competitors: offerings, pricing, USPs, locations, staffing and market presence * Mine external …",33898.68,33898.68,2026-03-24T13:38:06Z,https://www.adzuna.co.uk/jobs/land/ad/5676896237?se=hJMp4dQp8RGtR4i3pnY7PQ&utm_medium=api&utm_source=5731d18b&v=8D1678EA815E335C22077BF913DBD09205ADAD36,adzuna,2026-03-27,False,False,False,False,False,True,False,False,False,False,False,False,False,False,False,,33898.68,£25k–£35k,Mid-level
81,Data Analyst,TALENT INTERNATIONAL UK LTD,UK,Other UK,0,"Job Description: Data Analyst, Government Department. Remote / Midlands. Inside IR35. Our client is looking for an experienced Data Analyst who has worked in Central Government / Public Sector environments to work on a brand new AI-focused project in a DDaT, Agile environment. Data analysis expertise in this programme is needed to map the current use of data in the Department and consider options for improving first party data collection / analysis to support future marketing In this role, you …",117000.0,117000.0,2026-03-22T22:38:39Z,https://www.adzuna.co.uk/jobs/details/5675565496?utm_medium=api&utm_source=5731d18b,adzuna,2026-03-27,False,False,False,False,False,True,False,False,False,False,False,False,False,False,False,,117000.0,£70k+,Mid-level
82,Data Analyst,Morson Edge,"Wakefield, West Yorkshire",Other UK,0,"Data Analyst Currently looking for a skilled Data Analyst to join an established organisation with a growing BI function. You will engage with a stakeholders across the organisation to develop and maintain SQL and SSRS reports, support Power BI dashboards and enable decision-making across the business. Ultimately, making data a key enabler for both operational decisions and customer-facing insights. Key Responsibilities Develop and maintain reports using SQL, SSRS and Power BI Deliver accurate …",45000.0,45000.0,2026-03-25T22:41:27Z,https://www.adzuna.co.uk/jobs/details/5678559561?utm_medium=api&utm_source=5731d18b,adzuna,2026-03-27,False,True,True,False,False,True,False,False,False,False,False,False,False,False,False,,45000.0,£35k–£50k,Mid-level
83,Data Analyst,Zorba Consulting,"Blackpool, Lancashire",Other UK,0,"Data Analyst required by high growth travel firm in Blackpool. Salary: £40,000 -£50,000 plus pension, 25 days holidays, opportunity to purchase more Location: Blackpool, Lancashire - Office Based 5 days a week Environment: Innovative, energetic and collaborative culture with regular training and development opportunities. Looking for a skilled and results-driven Data Analyst with hands-on experience in Power BI to join their data team. This role focuses on analytical insight and transforming co…",50000.0,50000.0,2026-03-09T22:33:44Z,https://www.adzuna.co.uk/jobs/details/5659707858?utm_medium=api&utm_source=5731d18b,adzuna,2026-03-27,False,False,True,False,False,True,False,False,False,False,False,False,False,False,False,40000.0,50000.0,£50k–£70k,Mid-level
84,Data Analyst,Global Media Group,"London, UK",London,0,"Accepting applications until: 27 March 2026 Job Description Your new role: Data Analyst We’re looking for a mid-level Data Analyst with 3–5 years of commercial experience in a data analytics role , ideally within a fast-paced, data-driven business. As a Data Analyst at Global, you’ll combine your curiosity for insight and your enthusiasm for delivering effective analytical solutions to help evolve Global’s market-leading business. Key Responsibilities Building analytical solutions to meet compl…",51375.57,51375.57,2026-02-18T17:38:53Z,https://www.adzuna.co.uk/jobs/details/5634741854?utm_medium=api&utm_source=5731d18b,adzuna,2026-03-27,False,False,False,False,False,True,False,False,False,False,False,False,False,False,False,,51375.57,£50k–£70k,Mid-level
85,Data Analyst,Trust Housing Association Limited,"Juniper Green, Edinburgh",Scotland,0,"We're looking for a Data Analyst to help shape high-quality, data driven decision making across the Trust. You will join us on a full time, permanent basis and in return, you will receive a competitive salary of £40,313 to £43,589 (pay award pending). Location: Flexible/ Hybrid (Edinburgh/Glasgow) About Trust Housing: Trust Housing Association is a national housing, support and care provider, offering a range of accommodation and support services. Primarily serving older people in our communiti…",40000.0,40000.0,2026-02-19T14:01:34Z,https://www.adzuna.co.uk/jobs/details/5636044973?utm_medium=api&utm_source=5731d18b,adzuna,2026-03-27,False,False,False,False,False,True,False,False,False,False,False,False,False,False,False,40313.0,40000.0,£35k–£50k,Mid-level
86,Data Analyst,Fuel Recruitment Limited,UK,Other UK,0,"Data Analyst – Remote - Permanent – Up to £35,000 Per Annum  Benefits Fuel Recruitment is supporting a rapidly growing organisation within the full‑fibre broadband sector, currently seeking a Data Analyst to support delivery performance, reporting, and operational insight. This is an excellent opportunity to join a business where your analysis will directly influence strategic decisions and help drive smarter, faster programme execution. The client is a rapidly growing full‑fibre broadband prov…",30000.0,35000.0,2026-03-20T15:20:51Z,https://www.adzuna.co.uk/jobs/land/ad/5673149968?se=bFKz4tQp8RGtR4i3pnY7PQ&utm_medium=api&utm_source=5731d18b&v=6042F314E59EE105CCA8CD1FC1A85396EBA8E098,adzuna,2026-03-27,False,False,False,True,False,True,False,False,False,False,False,False,False,False,False,35000.0,30000.0,£25k–£35k,Mid-level
