id,title,company,location,region,is_remote,description,min_amount,max_amount,date_posted,job_url,site,scraped_date
1,UK&I Tax & Finance Data Analyst,Mars Wrigley Confectionery UK ,"Chalvey, Slough",Other UK,0,"Job Description: To support the tax professionals in ensuring all UK & Irish entities maintain high quality tax compliance and reporting. The role is responsible for the data, analysis, and controls that enable accurate, timely, and compliant tax reporting and tax return preparation for the UK & Ireland group. The jobholder partners closely with tax specialists, the Mars Accounting Service Centre, PwC, and business unit finance teams to ensure that accurate, complete, and well controlled data f…",32330.8,32330.8,2026-03-24T11:18:27Z,https://www.adzuna.co.uk/jobs/land/ad/5676750569?se=rFW-39Qp8RG-M-N3yaR3bQ&utm_medium=api&utm_source=5731d18b&v=7A0F68FA868DDFF69775C1CE70E1F1CC7C39F958,adzuna,2026-03-27
2,Data Analyst Trainee,ITOL Recruit,UK,Other UK,0,"Are you looking to benefit from a new career in Data Analysis? If you are detail orientated, perceptive, organised, competent, analytical and can communicate well with those around you; you could have a truly rewarding future as a Data Analyst We do this using our specialised Data Analyst career programme which looks to assist and place qualified candidates into a career pathway in Data Analysis. Please note this career program is designed for entry level individuals with limited or no experien…",30000.0,50000.0,2026-03-10T10:22:24Z,https://www.adzuna.co.uk/jobs/land/ad/5660173992?se=rFW-39Qp8RG-M-N3yaR3bQ&utm_medium=api&utm_source=5731d18b&v=5A3B81A9CB98CF9EAE311BB69AE5E54BCF443649,adzuna,2026-03-27
3,Data Analyst,Tria Recruitment,"Eastern England, UK",Other UK,0,"Data Support Analyst Hybrid - 1 - 2x days per week on site in Suffolk £35,000 - £40,000 per annum Join a global organisation on a mission to redefine what 'best-in-class' looks like. We're supporting an organisation backed by a leading private equity partner and fuelled by ambitious growth through ongoing M&A. This business is rapidly scaling to secure its position as the world's market leader in its sector. The pace is fast, the transformation is real, and the opportunity to make a genuine imp…",40000.0,40000.0,2026-03-27T03:50:05Z,https://www.adzuna.co.uk/jobs/land/ad/5679957391?se=rFW-39Qp8RG-M-N3yaR3bQ&utm_medium=api&utm_source=5731d18b&v=D444C4B775E5F96C26052F7BE2D450508330E4E0,adzuna,2026-03-27
4,Data Analyst,FOOTBALL ASSOCIATION,"Wembley, North West London",London,0,The FA's Grassroots division is looking for a Data Analyst with a collaborative mindset and the ability to communicate complex concepts to a variety of audiences. You will play a critical role in transforming Grassroots Football's data into actionable insights and easy‑to‑use self‑serve tools that empower internal teams and County FAs to make evidence‑based decisions. What will you be doing? Develop and maintain self‑serve dashboards and reporting tools that allow colleagues and the County FA n…,30048.69,30048.69,2026-03-17T09:45:51Z,https://www.adzuna.co.uk/jobs/details/5669419139?utm_medium=api&utm_source=5731d18b,adzuna,2026-03-27
5,Business Data Analyst,Wellington Professional Recruitment,"Belfast, Northern Ireland",Other UK,0,"Business Data Analyst Our Public Body Client requires a Property Business Data Analyst to join their Property & Estates Division , where you will play a key role in improving information management, business intelligence, and data-driven decision-making across the division. This role will support the deployment of best practice in data analysis, reporting, and digital solutions to enhance service delivery for both internal and external stakeholders. You will work closely with property, asset ma…",50000.0,50000.0,2026-03-26T04:03:23Z,https://www.adzuna.co.uk/jobs/land/ad/5678824411?se=rFW-39Qp8RG-M-N3yaR3bQ&utm_medium=api&utm_source=5731d18b&v=83690547EBAB9EC8A216186247032DDDD2CCB9A7,adzuna,2026-03-27
6,Senior Data Analyst,Trade Mastermind,"Orton Southgate, Peterborough",Other UK,0,"Senior Data Analyst Location: Peterborough (HQ) Company: Trade Mastermind & Valente Consulting Employment: Full-Time Salary: £50 000-£60 000 We are seeking a highly capable Senior Data Analyst / Data & Insights Manager to take full ownership of our data function across a fast-scaling £25M education and business services group. This role goes far beyond reporting you will transform data into actionable insight, enabling leadership to make high-impact decisions across multiple brands. In this pos…",60000.0,60000.0,2026-03-26T11:47:37Z,https://www.adzuna.co.uk/jobs/land/ad/5679242368?se=rFW-39Qp8RG-M-N3yaR3bQ&utm_medium=api&utm_source=5731d18b&v=C4BBF0EBB7F88B8D779AF8ACECC722276E05E929,adzuna,2026-03-27
7,Logistics Data Analyst,Outsource,"Earl Shilton, Leicester",Other UK,0,"Logistics Data Analyst Location: Desford Contract Length: 12 months (with potential to extend) Start Date: ASAP Hourly Rate: £25 per hour Umbrella Working Pattern: Full time on site. 07:00-15:30 Mon-Thurs, 07:00-12:30 Fri What You'll Be Doing Improve inbound/outbound material flow and drive continuous improvement Resolve material scheduling, transportation, and inventory issues Manage inventory levels and supplier delivery performance Support production needs during off-shifts Develop dashboard…",48917.0,48917.0,2026-03-26T11:49:05Z,https://www.adzuna.co.uk/jobs/land/ad/5679245587?se=rFW-39Qp8RG-M-N3yaR3bQ&utm_medium=api&utm_source=5731d18b&v=6C64D04F7E7741CB6688414476516D574A787D97,adzuna,2026-03-27
8,Data Analyst,Lusona Consultancy,UK,Other UK,0,"Job Title : Data Analyst Job Location: York or East Kilbride Job Salary: Up to £50,000  benefits Hybrid Working Available A leading organisation is seeking a talented Data Analyst to join its growing team. This is a fantastic opportunity for an analytical, commercially minded individual to play a key role in strengthening business intelligence across a diverse and fast‑paced group environment. Working closely with operational and commercial teams, you will be responsible for delivering actionab…",40000.0,50000.0,2026-03-18T20:42:55Z,https://www.adzuna.co.uk/jobs/land/ad/5671199952?se=rFW-39Qp8RG-M-N3yaR3bQ&utm_medium=api&utm_source=5731d18b&v=6E23471FBBD3EBEB9B44A1FC25E66827DAFCC710,adzuna,2026-03-27
9,Data Analyst,RedCentric,"London, UK",London,0,"About the Role At RedCentric, data drives our decisions and fuels our growth. We are seeking a skilled Data Analyst to join our team and transform complex data into actionable insights that empower our business strategies. This role offers a unique opportunity to work with diverse datasets, collaborate across departments, and contribute to impactful projects that shape the future of our company. Key Objectives Analyze and interpret data to identify trends, patterns, and opportunities. Deliver c…",29800.0,29800.0,2026-03-09T17:39:09Z,https://www.adzuna.co.uk/jobs/details/5659484919?utm_medium=api&utm_source=5731d18b,adzuna,2026-03-27
10,DATA ANALYST,Felix Consultants,"Solihull, West Midlands",Other UK,0,"We are seeking a detail-oriented and analytical Data Analyst to support data-driven decision-making across the organization. The ideal candidate will collect, analyze, and interpret data to generate actionable insights, support business operations, and improve overall performance. This role is suitable for candidates with foundational to intermediate experience in data analysis. Key Responsibilities Collect, clean, and validate data from multiple sources to ensure accuracy and consistency Analy…",40000.0,40000.0,2026-03-17T18:11:42Z,https://www.adzuna.co.uk/jobs/details/5669725390?utm_medium=api&utm_source=5731d18b,adzuna,2026-03-27
11,Data Analyst Intern,HK Consultants,"Birmingham, West Midlands",Birmingham,0,"We are looking for a detail-oriented Data Science Intern to support our team in collecting, analysing, and interpreting data. This internship will help you gain hands-on experience in data analysis, reporting, and business insights. Key Responsibilities: Collect and organise data from different sources Analyse datasets to identify trends and patterns Create reports and dashboards using Excel or other tools Assist the team in data-driven decision-making Maintain and update databases Requirements…",52000.0,52000.0,2026-03-09T17:35:29Z,https://www.adzuna.co.uk/jobs/details/5659484721?utm_medium=api&utm_source=5731d18b,adzuna,2026-03-27
12,Junior / Trainee Data Analyst,GET STAFFED ONLINE RECRUITMENT LIMITED,"Alcester, Warwickshire",Other UK,0,"Junior / Trainee Data Analyst Salary: £25,000 – £30,000 Location: Alcester (Hybrid) Our client is a technology-focused Mortgage Network, offering support services to Mortgage and Protection Advisers. Their goal is to continue to be the best home for Mortgage Advisers, Protection Specialists, Equity Release Experts and General Insurance Professionals, whatever their size or location, using market-leading technology. Key Responsibilities: Create, maintain, and enhance reporting solutions that pro…",25000.0,30000.0,2026-03-20T08:02:15Z,https://www.adzuna.co.uk/jobs/details/5672877170?utm_medium=api&utm_source=5731d18b,adzuna,2026-03-27
13,Data Analyst,Russell Tobin,"London, UK",London,0,"Rate 300 per day inside IR 35 12 Months contract Onsite Data Analyst-Media Insights & Planning/Spanish speaker Introduction to the Team: Travel Partnerships and Advertising helps partners, including hotels, airlines, destination marketing organizations (DMOs) and more, deliver excellent traveler and B2B experiences. We drive growth for our partners and the Expedia Group marketplace through competitive supply, our leading advertising and travel media network and affiliate solutions. Make An Impa…",52689.9,52689.9,2026-03-05T16:14:20Z,https://www.adzuna.co.uk/jobs/land/ad/5655061249?se=rFW-39Qp8RG-M-N3yaR3bQ&utm_medium=api&utm_source=5731d18b&v=C8346AFFE40DDAFAD760BA1835486E409A046B12,adzuna,2026-03-27
14,Data Analyst,Creditsafe,"Cardiff County, Wales",Other UK,0,"We are currently looking Data Analyst, to work in our Cardiff Bay office. You will be expected to attend the office 50% of the working week, to align with our hybrid working policy. WHO ARE WE? At Creditsafe, we weave our core values of customer-obsession, trust, respect and the courage to be different into the very fabric of our culture. With these values, we’ve fostered a culture of growth, innovation, well-being and success for the last 20 years at Creditsafe and created a legacy of successf…",39383.96,39383.96,2026-03-13T15:44:25Z,https://www.adzuna.co.uk/jobs/land/ad/5663594007?se=rFW-39Qp8RG-M-N3yaR3bQ&utm_medium=api&utm_source=5731d18b&v=1E8AA90CE0899C3C4721594DD9C5B872CA19B80C,adzuna,2026-03-27
15,Apprentice Recruitment & HR Data Analyst,FCC Environment,"Doncaster, South Yorkshire",Other UK,0,"Are you looking for the right role for you? Then look no further Apprentice Recruitment & HR Data Analyst Salary £17,400 - £25,396 Hours 35.7, Monday to Friday 8:30 - 5:00pm Location & Postcode Doncaster, DN4 5NU As an Apprentice Recruitment & HR Data Analyst at FCC Environment, you will support the HR and Recruitment team while developing your skills in HR data reporting, analytics, recruitment and HR systems. This role is designed to help you build a strong foundation in HR operations and dat…",24000.0,24000.0,2026-03-26T11:47:37Z,https://www.adzuna.co.uk/jobs/land/ad/5679242414?se=rFW-39Qp8RG-M-N3yaR3bQ&utm_medium=api&utm_source=5731d18b&v=73287748C09A0734AE4B4C770A672F0D4344C426,adzuna,2026-03-27
16,Data Analyst / Systems Analyst - Immediate Start!,MCS Group,"Banbridge, County Down",Other UK,0,"MCS Group is working with an established and growing manufacturing company in County Down as they look for a detail-oriented Data Analyst / Systems Analyst to support the implementation and optimisation of a new production and stock control system. This is an excellent opportunity for a Data Analyst or Systems Analyst who enjoys working with complex data, systems, and operational processes within a manufacturing environment. The Role This Data Analyst / Systems Analyst will help to build out th…",45000.0,45000.0,2026-03-13T03:40:38Z,https://www.adzuna.co.uk/jobs/land/ad/5663148378?se=rFW-39Qp8RG-M-N3yaR3bQ&utm_medium=api&utm_source=5731d18b&v=DC630EED3A4633CE946F223842ED4579693C6204,adzuna,2026-03-27
17,Data Analyst,Oliver James,"Leeds, West Yorkshire",Leeds,0,"Overview Oliver James has partnered with a leading global data and analytics organisation to support the hire of three Data Analysts on an initial 6-month contract. This is an opportunity to join a well-established financial services environment where data sits at the heart of decision-making. The team is undergoing transition and reshaping its onshore capability, so you'll play a key role in delivering and supporting cloud-based data solutions within a regulated setting. If you have strong dat…",117000.0,117000.0,2026-03-23T20:01:05Z,https://www.adzuna.co.uk/jobs/land/ad/5676174299?se=rFW-39Qp8RG-M-N3yaR3bQ&utm_medium=api&utm_source=5731d18b&v=800F7F23E4196D2AF8D54DD05A58E2C127022D82,adzuna,2026-03-27
18,Data Analyst,Harnham - Data & Analytics Recruitment,"London, UK",London,0,"Data Analyst (FTC) London or Milton Park, hybrid working Up to £55,000 plus benefits This is a standout opportunity to join a growing analytics function where your work directly shapes regulatory decision making. You will play a meaningful role in high-impact programmes, using your SQL expertise to support fair customer outcomes and contribute to business-critical reporting. The Company They are a forward-thinking financial services organisation committed to delivering simple, transparent produ…",50000.0,55000.0,2026-03-23T20:00:38Z,https://www.adzuna.co.uk/jobs/land/ad/5676172865?se=rFW-39Qp8RG-M-N3yaR3bQ&utm_medium=api&utm_source=5731d18b&v=241EC502B9337D503ED31EBB467BEB039FBAA3FF,adzuna,2026-03-27
19,Geophysical Data Analyst,Spectrum,"Lymington, Hampshire",Other UK,0,"Business Description Spectrum Geosurvey specialise in coastal geophysical surveys, supporting a wide range of clients in the offshore renewables sector. We have a proven track record delivering the highest-quality hydrographic and geophysical survey data. Spectrum Geosurvey are seeking an enthusiastic and dedicated individual to join our growing team based in our Lymington office. Position Overview As a Geophysical Data Analyst, you will be responsible for the analysis of geophysical data, maki…",40272.46,40272.46,2026-01-18T03:46:16Z,https://www.adzuna.co.uk/jobs/land/ad/5590118427?se=rFW-39Qp8RG-M-N3yaR3bQ&utm_medium=api&utm_source=5731d18b&v=837B500C1B1B349FA91C32A06F72D31C5303AA8D,adzuna,2026-03-27
20,AI & Data Analyst,PMC Treasury,"The City, Central London",London,0,"About us If you are looking to join an independent and impartial treasury and risk management consultancy, PMC is your solution. Established for over 34 years, we offer expert advice and practical solutions to financial sponsors and their portfolio companies globally – with offices in New York, London, Madrid and Singapore. We are at an early and exciting stage of embedding AI and data capabilities across the firm. This hire is central to that effort. The Role: We are looking for a commercially…",52439.8,52439.8,2026-03-05T16:14:49Z,https://www.adzuna.co.uk/jobs/land/ad/5655061463?se=rFW-39Qp8RG-M-N3yaR3bQ&utm_medium=api&utm_source=5731d18b&v=A9297A45BE99C1617057B4C68D594676B55F24C3,adzuna,2026-03-27
21,Data Analyst / Civil Engineer / Geophysicists / Geoscientist,Trace Structural Investigations,"London, UK",London,0,"Structural Investigation Data Analyst We are looking for a Structural Investigation Data Analyst to join our team at TRACE who has excellent technical report writing skills to deliver engineering-led insights for structural investigations and infrastructure projects. The role will involve interpreting GPR and NDT datasets. Ideally you will have GPR and NDT experience, if not we will provide training to get you up to speed. This is a fully remote position with no site-based work. You can be base…",30000.0,40000.0,2026-03-25T09:36:30Z,https://www.adzuna.co.uk/jobs/details/5677949525?utm_medium=api&utm_source=5731d18b,adzuna,2026-03-27
22,HR Data Analyst,Macmillan Davies,"London, UK",London,0,"HR Data Analyst12-Month Fixed Term Contract (Maternity Cover)London | Insurance / Financial ServicesI am working with a well-established, international insurance organisation torecruit an HR Data Analyst on a 12-month fixed term contract, commencing ideallyin early to mid-June to allow for a structured handover ahead of maternity leavein July.This role sits within a collaborative HR team and combines HR data reportingwith structured HR administration responsibilities.The RoleThe HR Data Analyst…",60000.0,61000.0,2026-03-23T19:59:27Z,https://www.adzuna.co.uk/jobs/land/ad/5676169064?se=rFW-39Qp8RG-M-N3yaR3bQ&utm_medium=api&utm_source=5731d18b&v=1085ED80BC9829DD1F670847E273F776C35DCD45,adzuna,2026-03-27
23,Finance Data Analyst,MSA Data Analytics Ltd,"London, UK",London,0,"Location: City, London - (Hybrid – 2 days office-based) Overview An excellent opportunity for a numerate early-career analyst to join a growing Treasury and Analytics function within a financial services organisation. This role offers exposure to both Treasury risk (liquidity & IRRBB) and data analytics, making it ideal for candidates interested in financial risk, modelling, or applied data analysis within a commercial environment. Key Responsibilities Support liquidity analysis, cashflow forec…",45000.0,55000.0,2026-03-25T10:11:16Z,https://www.adzuna.co.uk/jobs/land/ad/5677957765?se=rFW-39Qp8RG-M-N3yaR3bQ&utm_medium=api&utm_source=5731d18b&v=703FE6077111D731A54CB4FE425FB92A994A5746,adzuna,2026-03-27
24,Marketing Data & Analytics Analyst,Fisher Investments,"Fenchurch St, Central London",London,0,"The Opportunity: Fisher Investment Europe's Global Marketing Group is the lead generation engine for the European Private Client Group, and the Marketing Data & Analytics Team plays a critical role in that process. In this position, you will help guide key decisions while assessing performance. As a Marketing Data & Analytics Analyst, you will help maintain the flow of data through the department, provide timely analysis and reporting to all levels of Marketing stakeholders, and assist in ad ho…",55148.55,55148.55,2026-03-18T02:18:05Z,https://www.adzuna.co.uk/jobs/land/ad/5670254119?se=rFW-39Qp8RG-M-N3yaR3bQ&utm_medium=api&utm_source=5731d18b&v=0BC45367C5F53DD1BEDED6F603652627D78EBA33,adzuna,2026-03-27
25,Lead Data Analyst,Harnham - Data & Analytics Recruitment,"London, UK",London,0,"LEAD DATA ANALYST £65,000  Benefits LONDON (HYBRID) This is an opportunity to step into a high-impact Lead Data Analyst role where you shape data strategy, own end-to-end delivery, and influence senior stakeholders. You will work closely with performance-driven teams and have the freedom to build, innovate, and lead. The Company We are a fast-growing performance marketing and technology business that uses modern data tooling to drive commercial impact. Our focus is on building tailored analytic…",65000.0,65000.0,2026-03-24T16:07:30Z,https://www.adzuna.co.uk/jobs/land/ad/5676953780?se=rFW-39Qp8RG-M-N3yaR3bQ&utm_medium=api&utm_source=5731d18b&v=C4E80CD9407830EFFED09B4DA8CAA660B6DD9A2C,adzuna,2026-03-27
26,ECB Data Analyst,Adecco,"London, UK",London,0,"ECB Data Analyst* (Contract) Duration: 6 Months (Possibility for extension) Location: London/Hybrid (3 days per week on site) Rate: A highly competitive Umbrella Day Rate is available for suitable candidates Role Profile The External Data Analyst will support the ECB Onboarding Programme by translating business and regulatory requirements into clear external data needs and mapping these to existing datasets, systems, and vendor sources. The role will work closely with business stakeholders, Tec…",104000.0,126100.0,2026-03-25T15:49:45Z,https://www.adzuna.co.uk/jobs/land/ad/5678133813?se=rFW-39Qp8RG-M-N3yaR3bQ&utm_medium=api&utm_source=5731d18b&v=30A7375B56841E75516B0507CECC0D51988A59D1,adzuna,2026-03-27
27,Technical Building Data Analyst,Key Talent Solutions,"Hatfield, Hertfordshire",Other UK,0," We’re Hiring: Technical Building Data Analysts Are you passionate about buildings, data, and sustainability? We’re looking for Technical Building Data Analysts to join a growing team working on innovative housing asset management projects across the UK.  Locations: Hatfield and Manchester (with hybrid opportunities available) atf  The Role In this role, you’ll work with large property datasets to support effective asset management and long-term planning for residential portfolios. Your work wi…",44220.56,44220.56,2026-03-16T00:07:04Z,https://www.adzuna.co.uk/jobs/land/ad/5668117446?se=rFW-39Qp8RG-M-N3yaR3bQ&utm_medium=api&utm_source=5731d18b&v=252C6D3F47F8FD5F5F0E9BDC7660D5E21FDE2EAC,adzuna,2026-03-27
28,Client Data Analyst 1 - 12 Week Summer Internship,TP ICAP Group Services Ltd,"Belfast, Northern Ireland",Other UK,0,"Group Overview The TP ICAP Group is a world leading provider of market infrastructure. Our purpose is to provide clients with access to global financial and commodities markets, improving price discovery, liquidity, and distribution of data, through responsible and innovative solutions. Through our people and technology, we connect clients to superior liquidity and data solutions. The Group is home to a stable of premium brands. Collectively, TP ICAP is the largest interdealer broker in the wor…",52822.88,52822.88,2026-03-17T03:24:10Z,https://www.adzuna.co.uk/jobs/land/ad/5669139841?se=rFW-39Qp8RG-M-N3yaR3bQ&utm_medium=api&utm_source=5731d18b&v=EAAFD5965D9D214869375A7C07D4DB52245B041E,adzuna,2026-03-27
29,Marketing Data Analyst,Reed,"Gillingham, Kent",Other UK,0,"Ready to grow your marketing career in a fast-paced, data-driven team? My client is looking for a detail-focused Marketing Data Assistant/Analyst to help keep campaigns running smoothly and deliver impactful insights. Day-to-day of the role: Upload and manage promotional data across internal systems. Collaborate with marketing and eCommerce teams to ensure campaigns are up-to-date and effective. Analyse sales data and produce clear ROI and performance reports. Manage pricing spreadsheets, margi…",24000.0,25000.0,2026-03-25T22:10:01Z,https://www.adzuna.co.uk/jobs/land/ad/5678552037?se=rFW-39Qp8RG-M-N3yaR3bQ&utm_medium=api&utm_source=5731d18b&v=C7BE25D2768B4A43CB65DA442A4150823C315431,adzuna,2026-03-27
30,Senior Data Analyst - eFinancialCareers Global,eFinancialCareers Global,"London, UK",London,0,"The Opportunity: Help shape a Global Marketplace eFinancialCareers is the world’s leading financial services careers platform, connecting top talent with top employers in the banking, asset management, fintech, and financial technology sectors. With a global presence and unmatched industry insights, we connect the world’s leading financial services talent with global leaders in this space. We are a diverse company by design. We work collaboratively, share ideas and challenge conventional thinki…",84703.52,84703.52,2026-03-13T18:30:21Z,https://www.adzuna.co.uk/jobs/details/5663874595?utm_medium=api&utm_source=5731d18b,adzuna,2026-03-27
31,Marketing Data Analyst,Sphere Digital Recruitment,"London, UK",London,0,"An exciting company in London is looking for a Marketing Data Analyst to join their growing Marketing & Growth team. Based in: London (remote-first with cross-functional collaboration) Hybrid: Up to 2-3 days a week in the office (flexible) Contract: 3-month temp-to-perm Start date: ASAP (can wait for up to a 3-month notice) The Job As the Marketing Data Analyst , your responsibilities will include: Delivering advanced marketing performance analysis across multi-channel campaigns, including CPA,…",53537.51,53537.51,2026-03-23T19:57:39Z,https://www.adzuna.co.uk/jobs/land/ad/5676162658?se=rFW-39Qp8RG-M-N3yaR3bQ&utm_medium=api&utm_source=5731d18b&v=5310A9B5D9BAA761729BBDABEEE525E457515D82,adzuna,2026-03-27
32,Data Analyst,Contechs Consulting Ltd,"Warwick, Warwickshire",Other UK,0,"Data Analyst 11-month contract Based in West Midlands £29.86 per hour (Inside IR35) *Applicants MUST have proof of immediate, on-going and valid eligibility, to work full time, and travel within, the UK* About the company I am currently recruiting on behalf of an automotive OEM, based in West Midlands, who are looking for a Data Analyst to join their team. Job Description As Data Analyst, your main responsibilities will include: Identify opportunities, improvements and gaps, in current reportin…",60028.0,62108.0,2026-03-24T01:01:06Z,https://www.adzuna.co.uk/jobs/details/5676408667?utm_medium=api&utm_source=5731d18b,adzuna,2026-03-27
33,Data Analyst,Corecom,"Ossett, West Yorkshire",Other UK,0,"Data Analyst / Leeds (Hybrid) / £30,000 - £35,000  bonus Are you a Data Analyst who enjoys turning messy data into meaningful insight? Do you want the opportunity to modernise a company's entire data platform and help drive a business towards becoming truly data-driven? We're working with a growing organisation in Leeds that is investing in its data capability as part of a major modernisation programme. This role has been created to support the migration away from a legacy data platform and hel…",30000.0,35000.0,2026-03-20T18:53:59Z,https://www.adzuna.co.uk/jobs/details/5673269871?utm_medium=api&utm_source=5731d18b,adzuna,2026-03-27
