id,title,company,location,region,is_remote,description,min_amount,max_amount,date_posted,job_url,site,scraped_date,Python,SQL,Power BI,Excel,Tableau,R,Azure,AWS,Spark,Machine Learning,pandas,NumPy,Looker,dbt,Snowflake,parsed_salary,salary,salary_band,seniority
117,Data Analyst,Lusona Consultancy,UK,Other UK,0,"Job Title : Data Analyst Job Location: York or East Kilbride Job Salary: Up to £50,000  benefits Hybrid Working Available A leading organisation is seeking a talented Data Analyst to join its growing team. This is a fantastic opportunity for an analytical, commercially minded individual to play a key role in strengthening business intelligence across a diverse and fast‑paced group environment. Working closely with operational and commercial teams, you will be responsible for delivering actionab…",40000.0,50000.0,2026-03-18T20:42:55Z,https://www.adzuna.co.uk/jobs/land/ad/5671199952?se=nLBKGtcp8RG-M-N3yaR3bQ&utm_medium=api&utm_source=5731d18b&v=6E23471FBBD3EBEB9B44A1FC25E66827DAFCC710,adzuna,2026-03-27,False,False,False,False,False,True,False,False,False,False,False,False,False,False,False,50000.0,40000.0,£35k–£50k,Mid-level
118,Data Analyst,Russell Tobin,"London, UK",London,0,"Rate 300 per day inside IR 35 12 Months contract Onsite Data Analyst-Media Insights & Planning/Spanish speaker Introduction to the Team: Travel Partnerships and Advertising helps partners, including hotels, airlines, destination marketing organizations (DMOs) and more, deliver excellent traveler and B2B experiences. We drive growth for our partners and the Expedia Group marketplace through competitive supply, our leading advertising and travel media network and affiliate solutions. Make An Impa…",52689.9,52689.9,2026-03-05T16:14:20Z,https://www.adzuna.co.uk/jobs/land/ad/5655061249?se=nLBKGtcp8RG-M-N3yaR3bQ&utm_medium=api&utm_source=5731d18b&v=C8346AFFE40DDAFAD760BA1835486E409A046B12,adzuna,2026-03-27,False,False,False,True,False,True,False,False,False,False,False,False,False,False,False,,52689.9,£50k–£70k,Mid-level
119,Data Analyst,Creditsafe,"Cardiff County, Wales",Other UK,0,"We are currently looking Data Analyst, to work in our Cardiff Bay office. You will be expected to attend the office 50% of the working week, to align with our hybrid working policy. WHO ARE WE? At Creditsafe, we weave our core values of customer-obsession, trust, respect and the courage to be different into the very fabric of our culture. With these values, we’ve fostered a culture of growth, innovation, well-being and success for the last 20 years at Creditsafe and created a legacy of successf…",39383.96,39383.96,2026-03-13T15:44:25Z,https://www.adzuna.co.uk/jobs/land/ad/5663594007?se=nLBKGtcp8RG-M-N3yaR3bQ&utm_medium=api&utm_source=5731d18b&v=1E8AA90CE0899C3C4721594DD9C5B872CA19B80C,adzuna,2026-03-27,False,False,False,False,False,True,False,False,False,False,False,False,False,False,False,,39383.96,£35k–£50k,Mid-level
120,Apprentice Recruitment & HR Data Analyst,FCC Environment,"Doncaster, South Yorkshire",Other UK,0,"Are you looking for the right role for you? Then look no further Apprentice Recruitment & HR Data Analyst Salary £17,400 - £25,396 Hours 35.7, Monday to Friday 8:30 - 5:00pm Location & Postcode Doncaster, DN4 5NU As an Apprentice Recruitment & HR Data Analyst at FCC Environment, you will support the HR and Recruitment team while developing your skills in HR data reporting, analytics, recruitment and HR systems. This role is designed to help you build a strong foundation in HR operations and dat…",24000.0,24000.0,2026-03-26T11:47:37Z,https://www.adzuna.co.uk/jobs/land/ad/5679242414?se=nLBKGtcp8RG-M-N3yaR3bQ&utm_medium=api&utm_source=5731d18b&v=73287748C09A0734AE4B4C770A672F0D4344C426,adzuna,2026-03-27,False,False,False,False,False,True,False,False,False,False,False,False,False,False,False,17400.0,24000.0,Under £25k,Mid-level
121,Data Analyst / Systems Analyst - Immediate Start!,MCS Group,"Banbridge, County Down",Other UK,0,"MCS Group is working with an established and growing manufacturing company in County Down as they look for a detail-oriented Data Analyst / Systems Analyst to support the implementation and optimisation of a new production and stock control system. This is an excellent opportunity for a Data Analyst or Systems Analyst who enjoys working with complex data, systems, and operational processes within a manufacturing environment. The Role This Data Analyst / Systems Analyst will help to build out th…",45000.0,45000.0,2026-03-13T03:40:38Z,https://www.adzuna.co.uk/jobs/land/ad/5663148378?se=nLBKGtcp8RG-M-N3yaR3bQ&utm_medium=api&utm_source=5731d18b&v=DC630EED3A4633CE946F223842ED4579693C6204,adzuna,2026-03-27,False,False,False,True,False,True,False,False,False,False,False,False,False,False,False,,45000.0,£35k–£50k,Mid-level
122,Data Analyst,Oliver James,"Leeds, West Yorkshire",Leeds,0,"Overview Oliver James has partnered with a leading global data and analytics organisation to support the hire of three Data Analysts on an initial 6-month contract. This is an opportunity to join a well-established financial services environment where data sits at the heart of decision-making. The team is undergoing transition and reshaping its onshore capability, so you'll play a key role in delivering and supporting cloud-based data solutions within a regulated setting. If you have strong dat…",117000.0,117000.0,2026-03-23T20:01:05Z,https://www.adzuna.co.uk/jobs/land/ad/5676174299?se=nLBKGtcp8RG-M-N3yaR3bQ&utm_medium=api&utm_source=5731d18b&v=800F7F23E4196D2AF8D54DD05A58E2C127022D82,adzuna,2026-03-27,False,False,False,False,False,True,False,False,False,False,False,False,False,False,False,,117000.0,£70k+,Mid-level
123,Data Analyst,Harnham - Data & Analytics Recruitment,"London, UK",London,0,"Data Analyst (FTC) London or Milton Park, hybrid working Up to £55,000 plus benefits This is a standout opportunity to join a growing analytics function where your work directly shapes regulatory decision making. You will play a meaningful role in high-impact programmes, using your SQL expertise to support fair customer outcomes and contribute to business-critical reporting. The Company They are a forward-thinking financial services organisation committed to delivering simple, transparent produ…",50000.0,55000.0,2026-03-23T20:00:38Z,https://www.adzuna.co.uk/jobs/land/ad/5676172865?se=nLBKGtcp8RG-M-N3yaR3bQ&utm_medium=api&utm_source=5731d18b&v=241EC502B9337D503ED31EBB467BEB039FBAA3FF,adzuna,2026-03-27,False,True,False,False,False,True,False,False,False,False,False,False,False,False,False,55000.0,50000.0,£50k–£70k,Mid-level
124,Geophysical Data Analyst,Spectrum,"Lymington, Hampshire",Other UK,0,"Business Description Spectrum Geosurvey specialise in coastal geophysical surveys, supporting a wide range of clients in the offshore renewables sector. We have a proven track record delivering the highest-quality hydrographic and geophysical survey data. Spectrum Geosurvey are seeking an enthusiastic and dedicated individual to join our growing team based in our Lymington office. Position Overview As a Geophysical Data Analyst, you will be responsible for the analysis of geophysical data, maki…",40272.46,40272.46,2026-01-18T03:46:16Z,https://www.adzuna.co.uk/jobs/land/ad/5590118427?se=nLBKGtcp8RG-M-N3yaR3bQ&utm_medium=api&utm_source=5731d18b&v=837B500C1B1B349FA91C32A06F72D31C5303AA8D,adzuna,2026-03-27,False,False,False,False,False,True,False,False,False,False,False,False,False,False,False,,40272.46,£35k–£50k,Mid-level
125,AI & Data Analyst,PMC Treasury,"The City, Central London",London,0,"About us If you are looking to join an independent and impartial treasury and risk management consultancy, PMC is your solution. Established for over 34 years, we offer expert advice and practical solutions to financial sponsors and their portfolio companies globally – with offices in New York, London, Madrid and Singapore. We are at an early and exciting stage of embedding AI and data capabilities across the firm. This hire is central to that effort. The Role: We are looking for a commercially…",52439.8,52439.8,2026-03-05T16:14:49Z,https://www.adzuna.co.uk/jobs/land/ad/5655061463?se=nLBKGtcp8RG-M-N3yaR3bQ&utm_medium=api&utm_source=5731d18b&v=A9297A45BE99C1617057B4C68D594676B55F24C3,adzuna,2026-03-27,False,False,False,False,False,True,False,False,False,False,False,False,False,False,False,,52439.8,£50k–£70k,Mid-level
126,HR Data Analyst,Macmillan Davies,"London, UK",London,0,"HR Data Analyst12-Month Fixed Term Contract (Maternity Cover)London | Insurance / Financial ServicesI am working with a well-established, international insurance organisation torecruit an HR Data Analyst on a 12-month fixed term contract, commencing ideallyin early to mid-June to allow for a structured handover ahead of maternity leavein July.This role sits within a collaborative HR team and combines HR data reportingwith structured HR administration responsibilities.The RoleThe HR Data Analyst…",60000.0,61000.0,2026-03-23T19:59:27Z,https://www.adzuna.co.uk/jobs/land/ad/5676169064?se=nLBKGtcp8RG-M-N3yaR3bQ&utm_medium=api&utm_source=5731d18b&v=1085ED80BC9829DD1F670847E273F776C35DCD45,adzuna,2026-03-27,False,False,False,False,False,True,False,False,False,False,False,False,False,False,False,,60000.0,£50k–£70k,Mid-level
127,Finance Data Analyst,MSA Data Analytics Ltd,"London, UK",London,0,"Location: City, London - (Hybrid – 2 days office-based) Overview An excellent opportunity for a numerate early-career analyst to join a growing Treasury and Analytics function within a financial services organisation. This role offers exposure to both Treasury risk (liquidity & IRRBB) and data analytics, making it ideal for candidates interested in financial risk, modelling, or applied data analysis within a commercial environment. Key Responsibilities Support liquidity analysis, cashflow forec…",45000.0,55000.0,2026-03-25T10:11:16Z,https://www.adzuna.co.uk/jobs/land/ad/5677957765?se=nLBKGtcp8RG-M-N3yaR3bQ&utm_medium=api&utm_source=5731d18b&v=703FE6077111D731A54CB4FE425FB92A994A5746,adzuna,2026-03-27,False,False,False,True,False,True,False,False,False,False,False,False,False,False,False,,45000.0,£35k–£50k,Mid-level
128,Marketing Data & Analytics Analyst,Fisher Investments,"Fenchurch St, Central London",London,0,"The Opportunity: Fisher Investment Europe's Global Marketing Group is the lead generation engine for the European Private Client Group, and the Marketing Data & Analytics Team plays a critical role in that process. In this position, you will help guide key decisions while assessing performance. As a Marketing Data & Analytics Analyst, you will help maintain the flow of data through the department, provide timely analysis and reporting to all levels of Marketing stakeholders, and assist in ad ho…",55148.55,55148.55,2026-03-18T02:18:05Z,https://www.adzuna.co.uk/jobs/land/ad/5670254119?se=nLBKGtcp8RG-M-N3yaR3bQ&utm_medium=api&utm_source=5731d18b&v=0BC45367C5F53DD1BEDED6F603652627D78EBA33,adzuna,2026-03-27,False,False,False,False,False,True,False,False,False,False,False,False,False,False,False,,55148.55,£50k–£70k,Mid-level
129,Lead Data Analyst,Harnham - Data & Analytics Recruitment,"London, UK",London,0,"LEAD DATA ANALYST £65,000  Benefits LONDON (HYBRID) This is an opportunity to step into a high-impact Lead Data Analyst role where you shape data strategy, own end-to-end delivery, and influence senior stakeholders. You will work closely with performance-driven teams and have the freedom to build, innovate, and lead. The Company We are a fast-growing performance marketing and technology business that uses modern data tooling to drive commercial impact. Our focus is on building tailored analytic…",65000.0,65000.0,2026-03-24T16:07:30Z,https://www.adzuna.co.uk/jobs/land/ad/5676953780?se=nLBKGtcp8RG-M-N3yaR3bQ&utm_medium=api&utm_source=5731d18b&v=C4E80CD9407830EFFED09B4DA8CAA660B6DD9A2C,adzuna,2026-03-27,False,False,False,False,False,True,False,False,False,False,False,False,False,False,False,65000.0,65000.0,£50k–£70k,Senior
130,ECB Data Analyst,Adecco,"London, UK",London,0,"ECB Data Analyst* (Contract) Duration: 6 Months (Possibility for extension) Location: London/Hybrid (3 days per week on site) Rate: A highly competitive Umbrella Day Rate is available for suitable candidates Role Profile The External Data Analyst will support the ECB Onboarding Programme by translating business and regulatory requirements into clear external data needs and mapping these to existing datasets, systems, and vendor sources. The role will work closely with business stakeholders, Tec…",104000.0,126100.0,2026-03-25T15:49:45Z,https://www.adzuna.co.uk/jobs/land/ad/5678133813?se=nLBKGtcp8RG-M-N3yaR3bQ&utm_medium=api&utm_source=5731d18b&v=30A7375B56841E75516B0507CECC0D51988A59D1,adzuna,2026-03-27,False,False,False,False,False,True,False,False,False,False,False,False,False,False,False,,104000.0,£70k+,Mid-level
131,Technical Building Data Analyst,Key Talent Solutions,"Hatfield, Hertfordshire",Other UK,0," We’re Hiring: Technical Building Data Analysts Are you passionate about buildings, data, and sustainability? We’re looking for Technical Building Data Analysts to join a growing team working on innovative housing asset management projects across the UK.  Locations: Hatfield and Manchester (with hybrid opportunities available) atf  The Role In this role, you’ll work with large property datasets to support effective asset management and long-term planning for residential portfolios. Your work wi…",44220.56,44220.56,2026-03-16T00:07:04Z,https://www.adzuna.co.uk/jobs/land/ad/5668117446?se=nLBKGtcp8RG-M-N3yaR3bQ&utm_medium=api&utm_source=5731d18b&v=252C6D3F47F8FD5F5F0E9BDC7660D5E21FDE2EAC,adzuna,2026-03-27,False,False,False,False,False,True,False,False,False,False,False,False,False,False,False,,44220.56,£35k–£50k,Mid-level
132,Client Data Analyst 1 - 12 Week Summer Internship,TP ICAP Group Services Ltd,"Belfast, Northern Ireland",Other UK,0,"Group Overview The TP ICAP Group is a world leading provider of market infrastructure. Our purpose is to provide clients with access to global financial and commodities markets, improving price discovery, liquidity, and distribution of data, through responsible and innovative solutions. Through our people and technology, we connect clients to superior liquidity and data solutions. The Group is home to a stable of premium brands. Collectively, TP ICAP is the largest interdealer broker in the wor…",52822.88,52822.88,2026-03-17T03:24:10Z,https://www.adzuna.co.uk/jobs/land/ad/5669139841?se=nLBKGtcp8RG-M-N3yaR3bQ&utm_medium=api&utm_source=5731d18b&v=EAAFD5965D9D214869375A7C07D4DB52245B041E,adzuna,2026-03-27,False,False,False,False,False,True,False,False,False,False,False,False,False,False,False,,52822.88,£50k–£70k,Mid-level
133,Marketing Data Analyst,Sphere Digital Recruitment,"London, UK",London,0,"An exciting company in London is looking for a Marketing Data Analyst to join their growing Marketing & Growth team. Based in: London (remote-first with cross-functional collaboration) Hybrid: Up to 2-3 days a week in the office (flexible) Contract: 3-month temp-to-perm Start date: ASAP (can wait for up to a 3-month notice) The Job As the Marketing Data Analyst , your responsibilities will include: Delivering advanced marketing performance analysis across multi-channel campaigns, including CPA,…",53537.51,53537.51,2026-03-23T19:57:39Z,https://www.adzuna.co.uk/jobs/land/ad/5676162658?se=nLBKGtcp8RG-M-N3yaR3bQ&utm_medium=api&utm_source=5731d18b&v=5310A9B5D9BAA761729BBDABEEE525E457515D82,adzuna,2026-03-27,False,False,False,False,False,True,False,False,False,False,False,False,False,False,False,,53537.51,£50k–£70k,Mid-level
134,Data Analyst,Avara Foods,"Turweston, Brackley",Other UK,0,"Who are we, and what do we do? You may not have heard of us, but there’s a good chance you’ve enjoyed our products. Avara Foods is one of the UK’s leading food businesses, supplying chicken and turkey to the country’s major supermarkets and well-known restaurants. We own and manage our entire supply chain, from farms to factory and all the way to the customer door – meaning we have careers that cover a whole range of functions. We have major processing sites across England and an agricultural n…",44852.09,44852.09,2026-02-25T15:10:33Z,https://www.adzuna.co.uk/jobs/land/ad/5644869790?se=nLBKGtcp8RG-M-N3yaR3bQ&utm_medium=api&utm_source=5731d18b&v=F60D418751B68CBA805367DC349D47D313656DA0,adzuna,2026-03-27,False,False,False,False,False,True,False,False,False,False,False,False,False,False,False,,44852.09,£35k–£50k,Mid-level
135,Data Analyst,G-Research,"London, UK",London,0,"We tackle the most complex problems in quantitative finance, by bringing scientific clarity to financial complexity. From our London HQ, we unite world-class researchers and engineers in an environment that values deep exploration and methodical execution - because the best ideas take time to evolve. Together we’re building a world-class platform to amplify our teams’ most powerful ideas. As part of our engineering team, you’ll shape the platforms and tools that drive high-impact research - des…",56635.39,56635.39,2026-03-26T10:09:27Z,https://www.adzuna.co.uk/jobs/land/ad/5679132312?se=nLBKGtcp8RG-M-N3yaR3bQ&utm_medium=api&utm_source=5731d18b&v=A61997E4C1D605B07C27031CF354B5E0515F262E,adzuna,2026-03-27,False,False,False,False,False,True,False,False,False,False,False,False,False,False,False,,56635.39,£50k–£70k,Mid-level
136,Data Analyst,MWH Treatment,"Stepps, North Lanarkshire",Other UK,0,"We are looking to strengthen our Data Management team with an Data Analyst based at the Stepps office with hybrid working available. You will report directly to the Head of Strategy and PMO, and the role purpose is to develop, implement, manage, continually review and refine ESD’s information governance of, and to promote good practice in, the management of all data pertaining to the measured performance of ESD's prescribed activities. Prepare and present reliable data for monthly Operational, …",48532.52,48532.52,2026-02-12T17:26:47Z,https://www.adzuna.co.uk/jobs/land/ad/5626266948?se=nLBKGtcp8RG-M-N3yaR3bQ&utm_medium=api&utm_source=5731d18b&v=E771DB0BC33412646F3271177719499E851A710A,adzuna,2026-03-27,False,False,False,False,False,True,False,False,False,False,False,False,False,False,False,,48532.52,£35k–£50k,Mid-level
137,Data Analyst,Ferrovial,UK,Other UK,0,"Join Ferrovial: Where Innovation Meets Opportunity Are you ready to elevate your career with a global leader in infrastructure solving complex problems and generating a positive outcome on people’s lives? At Ferrovial , we are not just a company; we are a community of innovators and trailblazers. Listed on three major stock markets: Nasdaq (US), Euronext Amsterdam (Netherlands) and IBEX 35 (Spain), we are also member of the Dow Jones Sustainability Index and FTSE4Good. We operate in more than 1…",35469.79,35469.79,2026-01-08T09:40:01Z,https://www.adzuna.co.uk/jobs/land/ad/5573614045?se=nLBKGtcp8RG-M-N3yaR3bQ&utm_medium=api&utm_source=5731d18b&v=FF5AA20F38FED1052DE7EED7937212EC57AFD33E,adzuna,2026-03-27,False,False,False,False,False,True,False,False,False,False,False,False,False,False,False,,35469.79,£35k–£50k,Mid-level
138,Data Analyst,Premier Group Recruitment,"Earls Court, South West London",London,0,"Job Description For more information about this role please apply, or email Thomas Coombs on tcoombs@pgrec.co.uk who will be able to provide more details on the opportunity. Many thanks, Premier Group",40557.4,40557.4,2026-03-14T10:20:24Z,https://www.adzuna.co.uk/jobs/land/ad/5665227552?se=nLBKGtcp8RG-M-N3yaR3bQ&utm_medium=api&utm_source=5731d18b&v=E7E060A5A677003ADECDA6BF15F085AAF930DA32,adzuna,2026-03-27,False,False,False,False,False,True,False,False,False,False,False,False,False,False,False,,40557.4,£35k–£50k,Mid-level
139,Data Analyst,Vision Recruitment Ltd,"Kempston, Bedford",Other UK,0,"Data Analyst - 6 months fixed term contract Bedford To £45,000 We are a Bedford based on line distributor with a leading presence in our industry. Due to continued growth, we are looking for an experienced Data Analyst to join our successful team and help drive our business through data led decision making. As our Data Analyst, you will be responsible for extracting data from various sources, transforming it into a digestible format and building intuitive reports that our teams can rely on. You…",40000.0,45000.0,2026-03-24T15:40:49Z,https://www.adzuna.co.uk/jobs/land/ad/5676937640?se=7sGuG9cp8RGtR4i3pnY7PQ&utm_medium=api&utm_source=5731d18b&v=AE1B6D6FF665A2DD0E9FF09823EC5B615C89FBF6,adzuna,2026-03-27,False,False,False,False,False,True,False,False,False,False,False,False,False,False,False,45000.0,40000.0,£35k–£50k,Mid-level
140,Data Analyst,Opus Recruitment Solutions,"Farringdon, Central London",London,0,"Data Analyst| Outside IR35 | £400 - £450 | 6 months | Hybrid London We’re supporting a large company who are seeking a Data Analyst to turn business and regulatory requirements into actionable metadata within our data platform. This role defines how business logic operates through configuration rather than code, ensuring rules and behaviours are implemented accurately and consistently. Key Responsibilities Convert business needs and regulatory requirements into metadata‑driven configuration. De…",104000.0,117000.0,2026-03-02T21:39:08Z,https://www.adzuna.co.uk/jobs/land/ad/5651714082?se=7sGuG9cp8RGtR4i3pnY7PQ&utm_medium=api&utm_source=5731d18b&v=5D82B85DEE63059AF6029E81F5D741EE7794C034,adzuna,2026-03-27,False,False,False,False,False,True,False,False,False,False,False,False,False,False,False,400.0,104000.0,£70k+,Mid-level
141,Data Analyst,Vehicle Data Global Ltd,"Chesterfield, Derbyshire",Other UK,0,"Data Analyst | Chesterfield | Starting at £26,000 Are you passionate about data and fascinated by cars and road vehicles? Ready to take the next step in your analytics career? We’re looking for a detail-driven Data Analyst to join our growing team at Vehicle Data Global Ltd in Chesterfield! Why Join Us? At Vehicle Data Global , we power the UK’s vehicle data industry. From cutting-edge VRM Lookup services to full vehicle history checks through our VDI Check platform, we deliver fast, reliable, …",25000.0,26000.0,2026-03-17T19:59:20Z,https://www.adzuna.co.uk/jobs/land/ad/5669783048?se=7sGuG9cp8RGtR4i3pnY7PQ&utm_medium=api&utm_source=5731d18b&v=9670F05AA1865DAACA359CC5E5E17F9C00B08F4B,adzuna,2026-03-27,False,False,False,False,False,True,False,False,False,False,False,False,False,False,False,26000.0,25000.0,£25k–£35k,Mid-level
142,Data Analyst,Hays Technology,"Farringdon, Central London",London,0,"Data Analyst - ETL, Power BI, PACE, Databricks, Sharepoint Up to £500 per day (Inside IR35 - Umbrella) My client is an International Consultancy who require a Data Analyst with demonstrable ETL and Data manipulation skills to play a key role in transforming data across multiple systems through the use of tools such as Power BI, Databricks and Sharepoint as well as PACE. Key Requirements: Demonstrable experience of working as a Data Analyst in a large, commercial organisation Proven expertise in…",117000.0,130000.0,2026-02-26T21:07:21Z,https://www.adzuna.co.uk/jobs/land/ad/5646627403?se=7sGuG9cp8RGtR4i3pnY7PQ&utm_medium=api&utm_source=5731d18b&v=8B3004E8290B0BF48D7C0303FA069B6B242DC147,adzuna,2026-03-27,False,False,True,False,False,True,False,False,False,False,False,False,False,False,False,500.0,117000.0,£70k+,Mid-level
143,Data Analyst,CPS Group  Limited,"Grangetown, Cardiff",Other UK,0,"Role: Data Analyst Location: Cardiff (Hybrid - Flexible) Salary: £35,000 - £45,000  Benefits CPS Group are supporting a growing Financial Services organisation in the search for a Data Analyst to join their expanding Pricing team. This is an excellent opportunity to join a highly data-driven business where analytics plays a central role in decision-making. You'll work on a variety of projects, helping shape pricing strategy and delivering meaningful insights that directly impact business perfor…",35000.0,45000.0,2026-03-25T15:45:41Z,https://www.adzuna.co.uk/jobs/land/ad/5678133025?se=7sGuG9cp8RGtR4i3pnY7PQ&utm_medium=api&utm_source=5731d18b&v=60C9D051CFF48AB9E36F4C8AC09521809AE4C31A,adzuna,2026-03-27,False,False,False,True,False,True,False,False,False,False,False,False,False,False,False,35000.0,35000.0,£35k–£50k,Mid-level
144,Data Analyst,Owen Daniels,"Gloucester, Gloucestershire",Other UK,0,"Data Analyst (FTC / Contract) Gloucester - Hybrid – 3 days on site (Tuesday, Wednesday, Thursday) Fixed-Term Contract / Contract Overview We’re looking for a Data Analyst to join a Gloucester-based organisation on a fixed-term contract to support a number of key data initiatives across the business. This role will play a key part in improving reporting capability and supporting a new ERP programme , helping the business better extract, integrate and utilise data across multiple systems. This is…",50842.73,50842.73,2026-03-16T01:57:10Z,https://www.adzuna.co.uk/jobs/land/ad/5668204127?se=7sGuG9cp8RGtR4i3pnY7PQ&utm_medium=api&utm_source=5731d18b&v=0B277149296CD90EB467732D6E1F150291DC201D,adzuna,2026-03-27,False,False,False,False,False,True,False,False,False,False,False,False,False,False,False,,50842.73,£50k–£70k,Mid-level
